"Polling Station",,"Total No of Electors",,,,"Voters Turnout",,,,,,"Candidate ID and Name",,,,,,,,,,,,,,,
"Part No","Part Name",Male,Female,Other,"Total No. of electors",Male,Female,Other,Total,"No of voters identifying using EPIC","Tendered Voter","1 - KUNWAR RATANJIT PRATAP NARAIN SINGH","2 - RAJESH PANDEY URF GUDDU","3 - RADHE SHYAM SINGH","4 - DR. SANGAM MISHRA","5 - AKHAND","6 - AMEERUDDIN","7 - ARVIND","8 - KASHEEM ALI","9 - GOBARDHAN PRASAD","10 - JAHID","11 - BACHCHOOLAAL","12 - MARKANDE","13 - RAMDHANEE","14 - RAMPRATAP","15 - None of the Above","Total Votes Secured"
1,"PRIMARY SCHOOL SHIVPUR",613,467,0,1080,357,308,0,665,660,0,144,341,27,128,2,4,2,3,1,2,1,1,1,1,7,665
2,"PRIMARY SCHOOL BASANTPUR",559,436,0,995,254,238,0,492,492,0,183,203,16,35,5,7,4,1,1,3,4,2,4,7,17,492
3,"PRIMARY SCHOOL HARIHARPUR",824,706,0,1530,350,309,0,659,602,0,140,230,24,169,3,9,6,3,4,7,7,11,8,8,30,659
4,"PRIMARY SCHOOL BHAISAHA ROOM N0  _1",757,575,0,1332,467,338,0,805,805,0,121,315,145,199,2,4,5,1,1,2,0,2,3,2,3,805
5,"PRIMARY SCHOOL BHAISAHA  ROOM N0_2",548,385,0,933,320,274,0,594,594,0,68,302,13,169,6,6,6,2,2,3,3,1,3,3,7,594
6,"PRIMARY SCHOOL HANUMANGANJ ROOM NO_1",311,247,1,559,166,145,0,311,311,0,43,148,28,67,0,2,4,2,1,0,3,3,0,2,8,311
7,"PRIMARY SCHOOL HANUMANGANJ ROOM NO_2",577,468,0,1045,377,315,0,692,692,0,175,292,46,113,7,5,9,4,4,3,7,7,2,9,9,692
8,"PRIMARY SCHOOL HANUMANGANJ ROOM NO_3",306,240,0,546,219,147,0,366,366,0,107,65,138,38,2,0,2,1,1,0,1,0,4,2,5,366
9,"PRIMARY SCHOOL MAHDEVA ROOM N0_1",290,223,0,513,126,115,0,241,241,0,78,109,11,23,0,4,2,5,1,1,2,2,1,1,1,241
10,"PRIMARY SCHOOL MAHDEVA ROOM N0_2",287,221,0,508,151,141,0,292,292,0,100,109,19,36,0,7,4,1,1,5,1,0,3,1,5,292
11,"PRIMARY SCHOOL BUDHVA JANGAL",277,223,0,500,180,157,0,337,297,0,197,19,25,76,5,3,2,0,1,0,0,1,1,1,6,337
12,"PRIMARY SCHOOL GAINAHE JANGLE  ROOM N0_1",873,630,0,1503,483,340,0,823,823,0,530,145,34,79,3,3,4,6,2,5,0,5,0,2,5,823
13,"PRIMARY SCHOOL GAINAHE JANGLE  ROOM N0_2",536,419,0,955,282,233,0,515,515,0,249,37,9,188,0,0,5,1,2,1,1,1,7,4,10,515
14,"PRIMARY SCHOOL MADANPUR SUKRAULI  ROOM N0_1",399,308,0,707,276,232,0,508,508,0,163,59,13,248,2,2,2,1,1,1,2,1,3,2,8,508
15,"PRIMARY SCHOOL MADANPUR SUKRAULI  ROOM N0_2",615,530,0,1145,364,347,0,711,711,0,342,125,39,176,1,3,3,1,3,2,0,4,2,3,7,711
16,"PRIMARY SCHOOL MADANPUR SUKRAULI  ROOM N0_3",326,269,0,595,201,169,0,370,370,0,223,75,53,9,0,1,0,1,0,0,2,2,1,1,2,370
17,"PRIMARY SCHOOL BHEDIHARI NO -1",360,286,0,646,150,177,0,327,327,0,45,169,23,67,3,5,4,3,0,1,0,2,3,0,2,327
18,"PRIMARY SCHOOL SISAI DADHICH",196,192,0,388,130,123,0,253,234,0,61,76,8,103,0,1,1,0,0,0,1,0,0,0,2,253
19,"PRIMARY SCHOOL SISVA GOPAL ROOM N0 _1",637,511,0,1148,449,303,0,752,752,0,259,309,28,115,1,1,6,2,2,6,2,1,5,3,12,752
20,"PRIMARY SCHOOL SISVA GOPAL ROOM N0 _2",349,328,0,677,200,303,0,503,503,0,136,263,16,72,4,0,1,1,0,3,0,2,1,2,2,503
21,"PRIMARY SCHOOL SISVA GOPAL ROOM N0 _3",494,414,0,908,328,300,0,628,628,0,147,350,12,84,0,1,2,6,0,2,0,4,3,8,9,628
22,"PRIMARY SCHOOL PAKADI BRIJLAL N0-2",863,666,0,1529,610,410,0,1020,1020,0,295,465,89,130,6,5,9,1,0,1,1,2,6,5,5,1020
23,"PRIMARY SCHOOL SARANG CHHAPRA",471,372,0,843,290,262,0,552,552,0,171,259,18,74,3,2,0,13,0,1,1,1,3,1,5,552
24,"PRIMARY SCHOOL CHAMARDIHA",472,406,0,878,281,271,0,552,552,0,77,146,30,272,0,1,10,1,1,1,0,4,4,1,4,552
25,"JUNIOR HIGH  SCHOOLRAMPUR GONHA ROOM N0_1",665,534,0,1199,444,360,0,804,804,0,409,139,46,148,3,3,0,1,2,15,6,7,9,4,12,804
26,"JUNIOR HIGH  SCHOOLRAMPUR GONHA ROOM N0_2",236,189,0,425,153,118,0,271,271,0,114,43,38,62,1,3,1,2,1,3,1,0,1,0,1,271
27,"JUNIOR HIGH  SCHOOLRAMPUR GONHA ROOM N0_3",431,384,3,818,278,251,0,529,507,0,124,77,52,227,4,5,1,2,2,7,1,2,2,8,15,529
28,"JUNIOR HIGH  SCHOOLRAMPUR GONHA ROOM N0_4",576,546,0,1122,364,338,0,702,627,0,217,118,86,236,1,3,4,3,2,21,1,2,2,2,4,702
29,"PRIMARY SCHOOL SONBARSA",491,383,0,874,276,294,0,570,500,0,219,182,50,97,1,0,1,4,2,0,2,2,2,2,6,570
30,"PRIMARY SCHOOL SOHRAUNA  ROOM N0_1",594,470,0,1064,414,309,0,723,722,0,180,431,58,24,3,2,0,2,0,1,5,0,4,6,7,723
31,"PRIMARY SCHOOL SOHRAUNA  ROOM N0_2",676,513,0,1189,409,350,0,759,759,0,178,316,71,148,2,5,2,6,2,3,3,0,7,6,10,759
32,"UCHATAR MADHYAMIC SCHOOL SOHRAUNA   ROOM NO _1",742,545,0,1287,456,396,0,852,685,0,163,587,25,42,5,7,7,2,0,0,0,3,3,2,6,852
33,"UCHATAR MADHYAMIC SCHOOL SOHRAUNA   ROOM NO _2",589,423,0,1012,354,288,0,642,541,0,172,301,52,81,5,3,3,8,1,2,0,1,5,2,6,642
34,"PRIMARY SCHOOL KHADDA ROOM N0 _1",453,329,0,782,258,200,0,458,458,0,137,299,13,5,0,0,0,0,0,0,0,0,1,0,3,458
35,"PRIMARY SCHOOL KHADDA ROOM N0 _2",543,404,1,948,275,227,0,502,502,0,194,289,5,4,0,0,1,0,1,1,0,1,3,1,2,502
36,"PRIMARY SCHOOL KHADDA ROOM N0 _3",589,446,0,1035,261,210,0,471,471,0,197,241,13,5,2,0,0,1,0,0,1,2,3,2,4,471
37,"PRIMARY SCHOOL KHADDA ROOM N0 _4",368,284,0,652,184,136,0,320,320,0,99,160,24,16,0,1,0,5,0,1,1,1,5,3,4,320
38,"GANDHI INTER COLLAGE KHADDA   ROOM N0_1",321,281,0,602,172,132,0,304,304,0,114,178,5,3,1,1,0,0,0,0,1,0,1,0,0,304
39,"GANDHI INTER COLLAGE KHADDA   ROOM N0_2",280,204,0,484,91,66,0,157,157,0,55,92,4,3,0,1,0,0,0,0,0,0,1,0,1,157
40,"GANDHI INTER COLLAGE KHADDA   ROOM N0_3",341,178,0,519,88,47,0,135,135,0,42,73,15,0,2,1,1,0,0,0,1,0,0,0,0,135
41,"GANDHI INTER COLLAGE KHADDA   ROOM N0_4",643,516,0,1159,408,332,0,740,740,0,330,373,7,14,0,3,1,0,1,0,0,3,2,1,5,740
42,"KISAN INTER COLLAGE KHADDA ROOM N0_1",607,493,0,1100,341,319,0,660,657,0,356,240,4,48,1,0,1,1,0,0,0,1,2,2,4,660
43,"KISAN INTER COLLAGE KHADDA ROOM N0_2",546,450,0,996,282,247,0,529,529,0,208,290,9,13,0,0,1,1,0,0,0,1,1,1,4,529
44,"KISAN INTER COLLAGE KHADDA ROOM N0_3",402,319,0,721,228,176,0,404,402,0,165,226,2,3,3,0,0,0,0,1,0,1,0,0,3,404
45,"KISAN INTER COLLAGE KHADDA ROOM N0_4",629,476,0,1105,343,262,0,605,605,0,285,261,22,21,1,1,2,3,0,1,1,0,2,1,4,605
46,"KISAN INTER COLLAGE KHADDA ROOM N0_5",679,551,0,1230,377,325,0,702,702,0,299,269,13,101,2,2,2,2,0,0,0,2,2,1,7,702
47,"PRIMARY SCHOOL BASDILA",671,568,0,1239,436,402,0,838,838,0,408,243,26,122,3,0,2,2,2,11,1,1,5,4,8,838
48,"PRIMARY SCHOOL TURKAHA",783,585,0,1368,409,387,0,796,723,0,430,116,119,95,3,1,0,5,2,0,1,0,7,4,13,796
49,"PRIMARY SCHOOL LAXMIPUR ROOM NO_1",615,536,0,1151,410,379,0,789,789,0,206,135,33,390,2,2,5,6,0,0,0,3,3,2,2,789
50,"PRIMARY SCHOOL LAXMIPUR ROOM NO_2",386,299,0,685,246,205,0,451,451,0,220,186,16,16,0,2,2,1,1,0,0,2,3,1,1,451
51,"PRIMARY SCHOOL LAXMIPUR ROOM NO_3",249,200,0,449,163,145,0,308,284,0,125,85,5,78,1,0,0,0,0,4,2,1,2,1,4,308
52,"PRIMARY SCHOOL SHAHPUR PLACE LAXMIPUR",626,494,0,1120,347,260,0,607,601,0,416,100,20,40,3,9,3,0,5,2,1,3,2,1,2,607
53,"PRIMARY SCHOOL BHAGWANPUR",681,570,1,1252,400,378,0,778,550,0,315,131,66,238,2,3,9,3,3,2,0,1,2,1,2,778
54,"PRIMARY SCHOOL NAUTAR JANGAL  ROOM N0_1",509,383,0,892,331,253,0,584,584,0,215,200,26,112,2,7,6,1,2,3,1,3,3,1,2,584
55,"PRIMARY SCHOOL NAUTAR JANGAL  ROOM N0_2",539,378,0,917,344,286,0,630,630,0,237,211,38,85,5,9,8,4,2,2,3,1,9,2,14,630
56,"PRIMARY SCHOOL SALIKPUR PLACE MATHURA CHHAPRA",732,548,0,1280,320,227,0,547,547,0,93,371,39,13,3,6,3,4,2,1,1,1,1,3,6,547
57,"HIGHR SECENDARY SCHOOL BULAHAWA",520,376,0,896,244,254,0,498,412,0,89,259,33,78,0,5,4,2,2,6,1,2,6,4,7,498
58,"PRIMARY SCHOOL BULAHAWA BAIRATOLA  ROOM N0_1",659,577,0,1236,416,383,0,799,793,0,118,435,69,83,4,13,5,5,4,9,8,5,7,13,21,799
59,"PRIMARY SCHOOL BULAHAWA BAIRATOLA  ROOM N0_2",476,383,1,860,280,204,0,484,484,0,65,336,35,8,5,4,4,8,0,1,3,0,6,1,8,484
60,"PRIMARY SCHOOL BULAHAWA BAIRATOLA  ROOM N0_3",554,454,0,1008,300,356,0,656,652,0,179,308,98,18,2,5,2,5,6,4,2,4,10,4,9,656
61,"PRIMARY SCHOOL BULAHAWA BAIRATOLA  ROOM N0_4",374,250,0,624,175,181,0,356,356,0,228,45,17,31,2,1,1,12,2,2,1,2,4,0,8,356
62,"PRIMARY SCHOOL BULAHAWA  BAZAR ROOM N0 1",496,387,0,883,271,255,0,526,526,0,99,268,16,105,2,6,1,1,1,1,0,2,3,6,15,526
63,"PRIMARY SCHOOL BULAHAWA  BAZAR ROOM N0 2",510,375,0,885,251,256,0,507,507,0,34,116,9,312,6,2,5,3,3,0,1,4,3,1,8,507
64,"PRIMARY SCHOOL BULAHAWA  BAZAR ROOM N0 3",666,512,0,1178,369,285,0,654,600,0,164,416,38,23,3,0,2,1,0,0,1,0,1,1,4,654
65,"PRIMARY SCHOOL BULAHAWA  BAZAR ROOM N0 4",877,653,0,1530,563,300,0,863,863,0,182,506,75,74,3,2,0,0,0,1,4,3,0,4,9,863
66,"HIGHER SECENDARY SCHOOL BULAHAWA  ROOM NO_1",232,189,0,421,133,111,0,244,244,0,20,133,65,19,0,1,2,0,1,0,0,1,0,1,1,244
67,"HIGHER SECENDARY SCHOOL BULAHAWA  ROOM NO_2",354,237,0,591,183,149,0,332,330,0,33,156,30,69,3,4,3,0,0,4,3,7,3,6,11,332
68,"PRIMARY SCHOOL CHHITAUNI   ROOM NO_1",770,613,0,1383,434,355,0,789,789,0,199,358,56,141,4,4,3,4,2,2,3,1,6,0,6,789
69,"PRIMARY SCHOOL CHHITAUNI   ROOM NO_2",612,447,0,1059,299,226,0,525,525,0,80,239,77,77,2,6,5,0,3,4,4,2,5,5,16,525
70,"PRIMARY SCHOOL NARKAHAWA  ROOM NO_1",455,368,0,823,299,248,0,547,547,0,52,124,94,245,1,7,12,0,0,2,1,3,4,0,2,547
71,"PRIMARY SCHOOL NARKAHAWA  ROOM NO_2",563,453,0,1016,349,284,0,633,627,0,77,307,46,174,2,5,5,1,1,3,0,4,1,4,3,633
72,"PRIMARY SCHOOL TURKAHI",298,275,0,573,186,174,0,360,360,0,41,64,37,203,2,3,3,3,1,0,0,1,1,0,1,360
73,"PRIMARY SCHOOL DARGAULI  ROOM N0_1",580,414,0,994,343,286,0,629,629,0,134,157,20,266,10,0,3,0,3,4,4,4,6,4,14,629
74,"PRIMARY SCHOOL DARGAULI  ROOM N0_2",490,370,0,860,319,248,0,567,567,0,75,213,46,158,21,8,8,1,0,3,3,4,8,9,10,567
75,"JUNIOR HIGH SCHOOL DARGAULI  ROOM N0_1",651,528,1,1180,392,317,0,709,709,0,181,345,17,123,17,1,1,2,3,2,2,3,3,6,3,709
76,"JUNIOR HIGH SCHOOL DARGAULI  ROOM N0_2",545,383,0,928,314,227,0,541,541,0,184,244,14,61,3,6,6,4,1,0,1,1,5,3,8,541
77,"PRIMARY SCHOOL SURAJPUR PLACE PANIYAHAWA",631,483,0,1114,400,367,0,767,757,0,129,553,15,32,6,6,3,3,3,0,2,1,2,6,6,767
78,"PRIMARY SCHOOL BODHI CHHAPRA  ROOM NO_1",702,519,0,1221,355,271,0,626,617,0,307,95,133,47,2,2,4,3,2,3,0,4,3,5,16,626
79,"PRIMARY SCHOOL BODHI CHHAPRA  ROOM NO_2",382,286,0,668,234,158,0,392,382,0,156,64,143,7,2,1,0,0,1,1,2,2,3,2,8,392
80,"PRIMARY SCHOOL BODHI CHHAPRA  ROOM NO_3",562,434,0,996,312,256,0,568,568,0,308,116,78,33,1,2,0,0,1,2,1,3,4,4,15,568
81,"PRIMARY SCHOOL BODHI CHHAPRA  ROOM NO_4",364,282,1,647,234,141,0,375,375,0,205,83,44,15,0,5,0,4,0,0,0,1,6,2,10,375
82,"SADHAN SAHKARI SAMITI BODHI CHHAPRA  ROOM NO_1",341,256,0,597,144,161,0,305,305,0,201,35,16,40,1,1,1,1,0,1,1,2,3,0,2,305
83,"SADHAN SAHKARI SAMITI BODHI CHHAPRA  ROOM NO_2",430,313,1,744,174,191,0,365,365,0,225,44,11,56,0,2,5,5,2,0,0,3,1,4,7,365
84,"PRIMARY SCHOOL MALAHEYA",619,517,1,1137,414,413,0,827,816,0,329,255,45,141,6,4,10,7,13,1,2,1,7,5,1,827
85,"PRIMARY SCHOOL RAMPUR JANGAL  ROOM N0_1",897,687,0,1584,559,472,0,1031,1031,0,143,501,78,256,1,15,7,6,3,2,2,3,2,5,7,1031
86,"PRIMARY SCHOOL RAMPUR JANGAL  ROOM N0_2",202,163,0,365,139,124,0,263,263,0,36,150,11,57,0,0,0,2,2,0,0,0,2,3,0,263
87,"PRIMARY SCHOOLRAMNAGAR ROOM NO_1",284,226,0,510,207,179,0,386,386,0,51,125,32,153,3,2,6,1,2,1,0,2,2,2,4,386
88,"PRIMARY SCHOOLRAMNAGAR ROOM NO_2",455,355,0,810,319,262,0,581,581,0,166,268,64,34,0,1,3,4,5,7,1,0,6,6,16,581
89,"PRIMARY SCHOOL TINPARSA",190,170,0,360,137,133,0,270,270,0,76,113,6,58,0,1,2,0,0,1,0,1,4,1,7,270
90,"PRIMARY SCHOOLDHARMAULI /JINDA CHHAPRA   ROOM N0_1",520,439,0,959,303,346,0,649,615,0,55,98,295,164,4,2,4,0,1,4,3,2,6,6,5,649
91,"PRIMARY SCHOOLDHARMAULI /JINDA CHHAPRA   ROOM N0_2",271,243,0,514,189,167,0,356,350,0,105,41,72,126,0,1,0,1,0,2,1,2,1,0,4,356
92,"PRIMARY SCHOOL HATHIYA PLACE /DHANAUJI AABADKARI",371,313,0,684,222,200,0,422,420,0,259,57,20,69,0,1,5,3,0,2,0,1,2,0,3,422
93,"PRIMARY SCHOOLDHANAUJI AABADKARI PLACE HATHIYA",441,382,0,823,299,288,0,587,587,0,38,134,191,193,6,4,3,4,2,3,1,2,1,1,4,587
94,"PRIMARY SCHOOL KARDAH ROOM NO_1",650,491,0,1141,352,310,0,662,652,0,345,155,33,87,1,3,3,18,1,2,1,0,2,3,8,662
95,"PRIMARY SCHOOL KARDAH ROOM NO_2",331,391,0,722,208,270,0,478,470,0,150,189,18,105,0,1,0,0,2,2,1,2,0,2,6,478
96,"NAVEEN KANYA LAGHU MADHYAMIC SCHOOL KARDAH ROOM N0 _1",580,328,0,908,338,221,0,559,559,0,199,221,18,95,2,2,4,6,1,2,1,1,0,5,2,559
97,"NAVEEN KANYA LAGHU MADHYAMIC SCHOOL KARDAH ROOM N0 _2",408,292,0,700,225,204,0,429,428,0,131,164,31,81,1,3,2,0,0,1,2,0,5,2,6,429
98,"PRIMARY SCHOOL KARDAH",369,329,0,698,230,202,0,432,432,0,58,103,49,205,2,2,1,0,0,0,1,1,5,2,3,432
99,"PRIMARY SCHOOL AHERAULI ROOM N0_1",711,583,0,1294,456,372,0,828,800,0,300,306,12,173,4,1,0,9,1,3,2,0,2,6,9,828
100,"PRIMARY SCHOOL AHERAULI ROOM N0_2",655,569,0,1224,453,407,0,860,854,0,137,261,126,287,2,3,5,4,2,2,0,6,5,3,17,860
101,"PRIMARY SCHOOL JAKHANIYA",526,425,0,951,346,323,0,669,669,0,217,322,20,72,4,3,0,10,2,3,1,2,3,4,6,669
102,"PRIMARY SCHOOL SISVA MANIRAJ",638,540,1,1179,386,381,0,767,767,0,171,314,19,234,1,1,3,1,2,4,2,1,7,2,5,767
103,"PRIMARY SCHOOLBANJARI PATTI",729,521,0,1250,382,338,0,720,720,0,381,258,14,24,1,3,2,4,2,7,1,3,4,7,9,720
104,"PRIMARY SCHOOLBANJARI PATTI",198,175,0,373,113,104,0,217,217,0,24,122,3,52,0,3,5,1,0,1,0,2,2,2,0,217
105,"PRIMARY SCHOOL LAKHUA LAKHUYI",826,631,0,1457,548,402,0,950,950,0,197,316,40,343,4,4,4,1,6,5,1,6,6,2,15,950
106,"PRIMARY SCHOOL LAKHUA LAKHUYI",690,537,1,1228,410,289,0,699,699,0,191,381,52,35,3,6,5,4,0,1,3,4,5,1,8,699
107,"PRIMARY SCHOOL BAHOR SHHAPRA",643,533,0,1176,416,372,0,788,743,0,199,413,43,100,2,3,5,2,3,0,3,3,2,4,6,788
108,"PRIMARY SCHOOL BHAJAN CHHAPRA",640,562,0,1202,371,450,0,821,821,0,180,419,32,152,7,5,7,5,1,6,1,1,2,1,2,821
109,"PRIMARY SCHOOL NAVAL CHHAPRA",478,425,0,903,313,314,0,627,627,0,125,183,130,143,2,5,2,16,2,0,0,3,8,2,6,627
110,"PRIMARY SCHOOLMATHIYA BUJURG",858,749,0,1607,500,432,0,932,932,0,301,433,59,84,3,4,4,2,2,4,5,6,8,8,9,932
111,"PRIMARY SCHOOLMATHIYA BUJURG",701,548,0,1249,384,362,0,746,746,0,272,153,39,229,2,2,7,2,3,2,4,2,6,6,17,746
112,"PRIMARY SCHOOL LANGADI",459,364,0,823,380,224,0,604,604,0,260,222,41,43,4,3,6,0,2,2,0,2,1,6,12,604
113,"PRIMARY SCHOOL VISHUNPURA BUJURG",619,512,0,1131,366,323,0,689,689,0,379,201,50,32,3,3,4,1,2,3,1,2,3,2,3,689
114,"PRIMARY SCHOOL VISHUNPURA BUJURG",649,518,0,1167,411,318,0,729,600,0,221,384,55,35,2,7,2,2,3,1,1,1,5,5,5,729
115,"PRIMARY SCHOOL VISHUNPURA BUJURG",768,614,0,1382,436,439,0,875,769,0,448,76,69,244,4,4,4,2,2,4,3,2,2,3,8,875
116,"PRIMARY SCHOOL KOP JANGAL NEW BALUWA TOLA",469,389,0,858,270,244,0,514,425,0,154,136,33,101,2,1,1,0,1,56,2,0,5,2,20,514
117,"PRIMARY SCHOOL KOP JANGAL NEW BALUWA TOLA",898,690,0,1588,557,411,0,968,968,0,555,251,40,35,4,5,8,3,8,43,2,2,4,4,4,968
118,"PRIMARY SCHOOLBHEDI JANGAL",763,676,0,1439,444,474,0,918,918,0,125,242,132,332,3,12,5,7,6,15,4,6,7,9,13,918
119,"PRIMARY SCHOOLCHATUR CHHAPRA",545,456,0,1001,360,276,0,636,586,0,244,203,68,90,5,5,4,4,2,2,0,1,4,1,3,636
120,"PRIMARY SCHOOL CHATUR CHHAPRA",380,310,0,690,218,183,0,401,351,0,126,84,103,80,1,1,3,2,0,0,0,0,0,0,1,401
121,"PRIMARY SCHOOLFATAKDAUNA HERA CHHAPRA",738,590,0,1328,417,328,0,745,745,0,157,347,47,141,4,6,4,6,3,0,1,4,7,6,12,745
122,"PRIMARY SCHOOLLILADHAR CHHAPRA",440,356,0,796,227,240,0,467,450,0,259,118,10,52,2,2,1,5,0,2,0,1,3,3,9,467
123,"PRIMARY SCHOOLUDHO CHHAPRA",789,613,0,1402,413,444,0,857,857,0,205,506,29,64,6,2,2,6,2,3,2,5,6,7,12,857
124,"PRIMARY SCHOOLBHUJAULI KHURD",409,352,0,761,235,233,0,468,460,0,129,97,20,190,2,2,0,17,0,2,1,3,4,0,1,468
125,"PRIMARY SCHOOLBHUJAULI BUJURGD",867,650,1,1518,424,387,0,811,800,0,164,569,41,21,2,2,1,5,0,2,0,0,1,2,1,811
126,"PRIMARY SCHOOLBHUJAULI BUJURGD",874,762,0,1636,528,541,0,1069,1066,0,314,445,101,154,1,5,3,19,2,5,2,5,6,3,4,1069
127,"KANYA  PURVA MADHAYAMIC SCHOOL  BHUJAULI  BUJURG",796,643,0,1439,443,460,0,903,903,0,284,368,21,90,6,2,6,89,5,1,5,2,6,8,10,903
128,"KANYA  PURVA MADHAYAMIC SCHOOL  BHUJAULI  BUJURG",813,642,1,1456,472,393,0,865,865,0,144,454,26,164,6,4,7,4,2,2,2,5,9,7,29,865
129,"PRIMARY SCHOOL BAIRAGI PATTI  PAS CHIM TOLA",396,335,0,731,271,241,0,512,462,0,157,231,17,95,1,2,2,2,0,0,0,1,2,1,1,512
130,"PRIMARY SCHOOL MUNDERA",268,250,0,518,179,179,0,358,358,0,36,177,4,128,1,2,0,0,1,1,0,0,3,2,3,358
131,"PURVA MADHYAMIC SCHOOL PAHADPUR",374,295,0,669,213,208,0,421,421,0,55,206,101,49,0,3,3,1,0,0,0,0,1,2,0,421
132,"PRIMARY SCHOOL DHARANI PATTI",525,416,0,941,297,271,0,568,564,0,77,235,55,170,5,6,1,7,3,1,0,0,3,2,3,568
133,"PRIMARY SCHOOLDHARNI PATTI",606,464,0,1070,449,271,0,720,720,0,117,347,63,131,2,9,8,18,5,1,2,1,10,1,5,720
134,"PRIMARY SCHOOL  MANSHACHHAPRA",683,508,0,1191,372,409,0,781,781,0,149,244,205,130,4,2,3,4,3,3,6,5,8,1,14,781
135,"PRIMARY SCHOOL  TINVARDAHA",425,344,0,769,255,264,0,519,519,0,255,143,16,82,3,2,4,1,1,5,1,0,2,2,2,519
136,"JUNIOR HIGH SCHOOL  KATAYI BHARPURWA",511,425,0,936,305,215,0,520,471,0,118,230,20,119,2,7,1,1,5,1,3,0,6,2,5,520
137,"JUNIOR HIGH SCHOOL  KATAYI BHARPURWA",454,328,1,783,287,166,0,453,300,0,123,101,135,59,0,2,1,0,1,3,1,0,7,7,13,453
138,"JUNIOR HIGH SCHOOL  KATAYI BHARPURWA",873,605,0,1478,494,359,0,853,853,0,99,293,97,185,8,4,9,135,4,2,3,4,5,4,1,853
139,"PRIMARY SCHOOL KATAYI BHARPURWA",809,624,1,1434,547,353,0,900,900,0,112,256,173,223,5,3,10,75,2,2,2,13,5,6,13,900
140,"PRIMARY SCHOOL KATAYI BHARPURWA",735,587,0,1322,449,300,0,749,749,0,171,271,52,77,6,3,8,147,5,2,0,1,2,2,2,749
141,"KANYA PRIMARY SCHOOL KATAYI BHARPURAWA",779,552,0,1331,411,244,0,655,655,0,159,139,73,154,4,2,9,66,5,2,2,6,5,4,25,655
142,"KANYA PRIMARY SCHOOL KATAYI BHARPURAWA",223,152,0,375,125,75,0,200,200,0,56,52,24,25,0,4,0,20,0,3,4,1,3,2,6,200
143,"PRIMARY SCHOOL  PADARAHE /PAKADI",879,683,0,1562,510,411,0,921,830,0,285,354,41,196,5,8,8,3,3,0,1,3,8,1,5,921
144,"PRIMARY SCHOOL PATKHAULI",691,512,0,1203,439,334,0,773,773,0,204,259,85,196,4,6,0,8,3,0,0,0,3,2,3,773
145,"PRIMARY SCHOOL  DHANAHA",337,259,0,596,201,192,0,393,393,0,82,148,26,117,1,2,4,1,1,0,0,2,2,1,6,393
146,"PRIMARY SCHOOL JUDA CHHAPRA  PLACE  NIRMAL PATTI",485,370,0,855,283,230,0,513,513,0,103,136,50,168,2,7,4,35,0,1,0,1,2,2,2,513
147,"PRIMARY SCHOOL KHAIRY",755,577,0,1332,428,363,0,791,791,0,190,272,129,126,2,3,4,49,0,6,2,2,4,1,1,791
148,"PRIMARY SCHOOL KHAIRY",843,613,2,1458,404,355,0,759,759,0,162,309,42,138,3,4,5,69,6,4,0,2,4,2,9,759
149,"PRIMARY SCHOOL  KISHUNPUR VIJAYPUR",529,463,0,992,379,334,0,713,691,0,133,310,49,163,3,2,2,7,0,0,2,2,11,12,17,713
150,"PRIMARY SCHOOL DEVGAV",539,446,0,985,313,292,0,605,605,0,155,285,43,97,3,2,5,3,2,0,1,0,3,4,2,605
151,"PRIMARY SCHOOL SEKHUYI KHAS",493,435,0,928,343,312,0,655,600,0,120,177,222,101,1,1,2,1,1,6,2,4,10,2,5,655
152,"KANYA JUNIOR HIGH SCHOOL NEBUA RAIGANJ",674,534,3,1211,399,352,0,751,751,0,245,184,78,140,1,0,2,7,6,52,4,4,7,6,15,751
153,"KANYA JUNIOR HIGH SCHOOL NEBUA RAIGANJ",517,413,0,930,309,263,0,572,572,0,84,240,32,177,3,2,0,0,2,21,3,1,3,0,4,572
154,"PRIMARY SCHOOL NEBUA RAIGANJ",466,377,0,843,297,230,0,527,527,0,183,230,33,62,3,2,3,3,0,7,0,0,0,1,0,527
155,"PRIMARY SCHOOLNEBUA RAIGANJ",140,130,0,270,75,69,0,144,104,0,50,82,1,7,0,0,0,0,0,0,2,1,1,0,0,144
156,"PRIMARY SCHOOLSHIVDAT  CHHAPRA",911,732,0,1643,486,406,0,892,892,0,199,271,127,259,4,3,2,6,2,1,1,3,6,3,5,892
157,"PRIMARY SCHOOLSURAT CHHAPRA",416,325,0,741,275,235,0,510,400,0,50,169,66,204,0,3,3,2,0,0,1,4,5,2,1,510
158,"PRIMARY SCHOOL NARAYANPUR",554,473,0,1027,347,286,0,633,632,0,74,287,90,136,0,2,4,0,1,2,3,2,9,6,17,633
159,"PRIMARY SCHOOLKOHARGADDI",512,404,0,916,277,270,0,547,534,0,223,127,14,90,1,4,1,71,3,2,1,4,3,1,2,547
160,"PRIMARY SCHOOLKOHARGADDI",431,341,0,772,202,198,0,400,398,0,182,140,26,18,2,2,0,14,2,0,2,2,1,4,5,400
161,"JUNIOR HIGH SCHOOL KOHARGADDI",627,479,0,1106,330,322,0,652,575,0,310,239,31,38,2,5,2,12,1,3,2,0,1,2,4,652
162,"JUNIOR HIGH SCHOOL KOHARGADDI",606,483,0,1089,314,297,0,611,611,0,237,128,21,172,3,2,2,29,3,1,1,1,5,1,5,611
163,"PRIMARY SCHOOL  DARBAHA GANGA  CHHAPRA",577,397,0,974,271,273,0,544,544,0,276,125,63,36,1,1,2,36,0,0,1,0,1,1,1,544
164,"PRIMARY SCHOOL BANDHU CHHAPRA",337,273,1,611,199,209,0,408,408,0,122,142,19,105,0,3,2,1,0,0,2,3,5,3,1,408
165,"PRIMARY SCHOOL EKDANGA BHAJAN CHHAPRA",563,433,0,996,330,276,0,606,506,0,217,170,39,150,0,2,2,9,1,1,1,1,7,1,5,606
166,"PRIMARY SCHOOL GULRIHA",389,322,0,711,272,244,0,516,516,0,93,122,58,229,4,0,0,4,0,0,1,2,0,0,3,516
167,"PRIMARY SCHOOL EKDANGI",774,602,0,1376,550,403,0,953,953,0,285,421,90,83,3,8,4,4,2,3,3,7,12,12,16,953
168,"PRIMARY SCHOOL KUNDELI PATTI",579,432,0,1011,330,295,0,625,625,0,113,182,210,79,1,2,3,1,1,2,4,10,3,4,10,625
169,"DOCTOR RAJENDRA PRASAD INTER COLLAGE BARWA RATANPUR",804,632,1,1437,442,312,0,754,667,0,243,288,43,150,5,4,6,3,1,1,1,2,1,0,6,754
170,"DOCTOR RAJENDRA PRASAD INTER COLLAGE BARWA RATANPUR",754,615,0,1369,349,286,0,635,618,0,130,284,48,137,0,2,8,6,1,2,2,2,7,1,5,635
171,"DOCTOR RAJENDRA PRASAD INTER COLLAGE BARWA RATANPUR",696,559,0,1255,349,320,0,669,664,0,305,184,82,58,5,4,1,11,0,1,1,4,4,1,8,669
172,"DOCTOR RAJENDRA PRASAD INTER COLLAGE BARWA RATANPUR",645,500,0,1145,345,254,0,599,599,0,216,289,26,34,3,2,0,5,2,0,0,1,5,4,12,599
173,"PRIMARY SCHOOL VINDAWALIYA",382,325,0,707,232,205,0,437,337,0,117,118,96,89,1,4,0,0,1,3,1,1,3,1,2,437
174,"PRIMARY SCHOOL ATARDIHA",639,517,1,1157,408,372,0,780,700,0,274,204,22,233,4,4,7,1,2,0,1,5,12,3,8,780
175,"PRIMARY SCHOOL BELWA",693,592,0,1285,432,356,0,788,788,0,367,223,58,98,3,3,2,1,3,1,1,3,4,7,14,788
176,"PRIMARY SCHOOL SEMRA",437,335,0,772,227,216,0,443,443,0,310,94,8,9,1,3,0,0,3,1,1,0,2,3,8,443
177,"PRIMARY SCHOOL SISVA /SISVANIYA",546,429,0,975,351,281,0,632,632,0,199,177,98,122,1,2,4,0,0,0,2,10,8,4,5,632
178,"PRIMARY SCHOOL BALUWAHE",562,463,0,1025,367,330,0,697,697,0,229,199,63,171,2,2,6,0,0,2,2,3,11,3,4,697
179,"PRIMARY SCHOOL BALI",346,304,0,650,204,169,0,373,373,0,162,62,19,99,6,0,3,2,0,2,2,4,3,2,7,373
180,"JUNIOR HIGH SCHOOL DEVATAHA",604,464,1,1069,400,285,0,685,500,0,128,267,129,81,3,1,5,3,6,0,3,1,13,15,30,685
181,"JUNIOR HIGH SCHOOL DEVATAHA",581,429,0,1010,319,270,0,589,589,0,219,213,71,45,4,6,4,1,2,4,0,6,4,3,7,589
182,"PRIMARY SCHOOL DEVATAHA",767,643,0,1410,407,374,0,781,781,0,311,235,59,110,5,3,3,17,4,5,1,0,8,6,14,781
183,"PRIMARY SCHOOL RAIPUR BHAISAHE",522,496,0,1018,285,304,0,589,570,0,285,178,46,53,1,3,0,1,4,2,3,1,6,2,4,589
184,"PRIMARY SCHOOL RAIPUR BHAISAHE",296,267,0,563,157,161,0,318,310,0,134,116,26,29,0,1,0,0,0,0,2,0,1,2,7,318
185,"JUNIOR HIGH SCHOOL BARWA",334,282,0,616,128,200,0,328,320,0,24,207,54,21,1,3,0,0,0,0,0,0,4,7,7,328
186,"PRIMARY SCHOOL RAIPUR KHAS",609,498,0,1107,379,327,0,706,705,0,56,196,201,205,2,3,1,3,0,2,4,9,4,4,16,706
187,"PRIMARY SCHOOL RAIPUR FULWARIYA",306,295,0,601,158,200,0,358,358,0,70,183,68,10,1,0,0,1,2,0,0,2,5,10,6,358
188,"PANCHAYAT BHAVAN RAIPUR BANJARI",544,466,0,1010,332,312,0,644,627,0,105,349,79,62,2,3,2,12,2,0,1,8,5,7,7,644
189,"PRIMARY SCHOOL SAKHUYI",461,366,0,827,298,245,0,543,445,0,149,195,19,134,3,4,6,0,2,1,0,20,3,2,5,543
190,"PRIMARY SCHOOL KHAJURI",587,433,0,1020,200,337,0,537,507,0,117,358,22,20,1,4,0,1,1,1,1,4,2,2,3,537
191,"PRIMARY SCHOOL KHAJURI",418,282,0,700,246,203,0,449,402,0,146,198,34,45,4,3,1,1,1,1,0,5,1,2,7,449
192,"PRIMARY SCHOOL PADARI MEHADIYA",671,504,0,1175,368,308,0,676,608,0,236,284,49,85,1,2,1,1,1,1,0,3,3,1,8,676
193,"PRIMARY SCHOOL PADARI MEHADIYA",446,318,0,764,255,185,0,440,427,0,77,311,19,23,0,0,0,0,1,0,1,0,2,1,5,440
194,"PRIMARY SCHOOL RAMPUR BANGAR",408,315,0,723,261,203,0,464,372,0,178,138,111,21,0,3,2,2,2,1,2,0,2,0,2,464
195,"PRIMARY SCHOOL RAMPUR BANGAR",466,412,0,878,318,260,0,578,578,0,195,175,125,58,0,1,1,2,1,1,1,2,4,3,9,578
196,"PRIMARY SCHOOL MAHESHRA",292,238,0,530,177,163,0,340,340,0,42,231,7,49,1,3,1,1,0,0,0,0,2,2,1,340
197,"PRIMARY SCHOOL NAUGAWA",699,486,0,1185,437,340,0,777,677,0,325,292,64,79,3,3,3,1,1,0,1,0,1,1,3,777
198,"PRIMARY SCHOOL GADAHEYA BASANTPUR",728,538,0,1266,415,331,0,746,730,0,357,320,36,15,1,2,1,11,0,0,0,1,2,0,0,746
199,"PRIMARY SCHOOL GADAHEYA BASANTPUR",714,511,0,1225,399,357,0,756,756,0,304,352,13,17,6,4,4,25,1,5,2,3,6,4,10,756
200,"PRIMARY SCHOOL DHOLHA",565,370,0,935,318,272,0,590,559,0,206,81,190,46,4,2,0,20,0,2,1,3,9,10,16,590
201,"PRIMARY SCHOOL DHOLHA",733,522,0,1255,472,329,0,801,670,0,389,91,212,67,2,3,1,30,0,0,1,0,0,1,4,801
202,"PRIMARY SCHOOL HARPUR BATESARA",509,378,0,887,400,189,0,589,589,0,343,78,46,45,1,3,4,24,5,4,1,4,4,6,21,589
203,"PRIMARY SCHOOL PIPARIYA NARHAR",428,353,0,781,252,193,0,445,340,0,212,144,37,32,1,2,0,13,0,1,0,0,0,1,2,445
204,"PRIMARY SCHOOL PIPARIYA NARHAR",264,200,0,464,155,114,0,269,268,0,82,49,67,62,0,2,0,0,0,0,1,2,2,1,1,269
205,"JANTA INTER COLLAGE KOTWA KALA",712,590,0,1302,426,334,0,760,700,0,286,268,132,46,3,3,1,10,1,1,0,2,1,2,4,760
206,"JANTA INTER COLLAGE KOTWA KALA",893,733,0,1626,423,533,0,956,956,0,395,283,61,161,8,5,2,13,2,1,5,5,6,4,5,956
207,"JANTA INTER COLLAGE KOTWA KALA",142,110,0,252,79,49,0,128,125,0,58,39,17,7,0,0,0,4,0,0,0,0,0,1,2,128
208,"PANCHAYAT BHAWAN VISHUNPURA KHURD",552,416,0,968,333,288,0,621,621,0,180,148,148,121,5,0,3,1,0,0,0,4,6,1,4,621
209,"PANCHAYAT BHAWAN VISHUNPURA KHURD",265,198,0,463,191,142,0,333,333,0,62,213,15,12,1,3,4,1,0,6,1,2,0,5,8,333
210,"PRIMARY SCHOOL MANSHA CHHAPRA",371,303,0,674,216,170,0,386,382,0,131,174,20,35,3,3,0,0,0,1,1,7,3,4,4,386
211,"PRIMARY SCHOOL PARSAUNI",612,512,0,1124,374,344,0,718,718,0,84,334,121,158,1,2,1,1,1,2,4,3,3,1,2,718
212,"PRIMARY SCHOOL BARGAHA",485,357,0,842,319,249,0,568,565,0,135,284,50,48,2,4,2,14,1,1,1,0,4,7,15,568
213,"JUNIOR HIGH SCHOOL PANDEY CHHAPRA",712,563,0,1275,430,327,0,757,732,0,177,202,33,293,4,4,4,5,2,9,5,7,6,1,5,757
214,"JUNIOR HIGH SCHOOL PANDEY CHHAPRA",289,207,0,496,144,104,0,248,247,0,116,71,21,18,2,3,1,0,0,3,2,3,1,0,7,248
215,"PRIMARY SCHOOL NAURANGIYA",723,640,1,1364,416,452,0,868,868,0,212,460,23,117,3,7,0,1,1,3,2,2,4,8,25,868
216,"PRIMARY SCHOOL NAURANGIYA",593,513,0,1106,388,324,0,712,712,0,230,265,53,122,2,1,2,18,0,3,3,3,3,1,6,712
217,"JUNIOR HIGH SCHOOL NAURANGIYA",577,466,0,1043,310,262,0,572,572,0,148,281,50,26,3,1,3,32,2,2,0,4,5,5,10,572
218,"PRIMARY SCHOOL  PIPARPATI",540,450,1,991,360,309,0,669,669,0,185,219,90,138,4,2,2,6,1,2,0,4,5,2,9,669
219,"PRIMARY SCHOOL SARGATIYA",405,322,1,728,256,211,0,467,467,0,79,229,37,97,1,4,0,2,0,0,2,3,3,3,7,467
220,"HARIJAN PRIMARY SCHOOL SIRSIYAKALA",627,494,0,1121,389,312,0,701,701,0,339,174,80,82,3,2,5,14,0,0,0,0,0,2,0,701
221,"HARIJAN PRIMARY SCHOOL SIRSIYAKALA",583,499,0,1082,389,323,0,712,712,0,203,272,128,88,4,5,0,7,0,1,0,0,0,3,1,712
222,"PRIMARY SCHOOLBASANTPUR",328,252,0,580,231,146,0,377,360,0,108,201,31,27,1,0,2,1,0,0,1,0,2,1,2,377
