"Polling Station",,"Total No of Electors",,,,"Voters Turnout",,,,,,"Candidate ID and Name",,,,,,,,,,,,,,,
"Part No","Part Name",Male,Female,Other,"Total No. of electors",Male,Female,Other,Total,"No of voters identifying using EPIC","Tendered Voter","1 - AJIT SINGH","2 - GHULAM MOHAMMED","3 - PRASHANT CHAUDHRI","4 - DR. SATYA PAL SINGH","5 - ANIL KUMAR","6 - KRISHAN PAL","7 - YUNUSH","8 - SOMENDAR DHAKA","9 - AJAY PAL","10 - ARVIND","11 - JAIVINDRA KUMAR","12 - NISHANT","13 - RUKSANA","14 - SUBHASH CHAND KASHYAP","15 - None of the Above","Total Votes Secured"
1,"JAIN INTER COLLEGE  EAST ROOM NO1BAGHPAT",664,516,0,1180,430,319,0,749,575,0,20,583,25,115,0,0,0,0,0,0,1,0,1,1,3,749
2,"JAIN INTER COLLEGE EAST ROOM NO2 BAGHPAT",321,247,0,568,249,161,0,410,280,0,8,100,10,286,1,0,0,1,1,0,2,1,0,0,0,410
3,"JAIN INTER COLLEGE  BAGHPAT",850,690,0,1540,546,297,0,843,726,0,56,512,64,199,0,0,1,7,0,0,1,0,0,1,2,843
4,"JAIN INTER COLLEGE BAGHPAT",567,485,0,1052,393,269,0,662,662,0,21,99,87,442,0,0,0,8,1,0,1,0,1,1,1,662
5,"JAIN INTER COLLEGE BAGHPAT",278,218,0,496,186,140,0,326,322,0,27,5,48,237,0,0,0,2,0,0,2,2,1,0,2,326
6,"JAIN INTER COLLEGE ROOM NO3 BAGHPAT",530,390,0,920,363,219,0,582,539,0,11,479,44,42,2,0,1,1,0,1,1,0,0,0,0,582
7,"JAIN INTER COLLEGE ROOM NO4 BAGHPAT",466,354,0,820,293,218,0,511,482,0,13,436,51,6,0,0,0,1,0,1,0,0,1,1,1,511
8,"YAMUNA INTER COLLEGE PASHICHAM BAGH BAGHPAT",812,651,0,1463,499,348,0,847,711,0,23,516,44,255,0,0,0,1,2,0,1,1,0,1,3,847
9,"YAMUNA INTER COLLEGE PASHICHAM BAGH BAGHPAT",517,377,0,894,343,233,0,576,503,0,19,266,31,250,0,0,0,3,0,1,1,1,0,0,4,576
10,"YAMUNA INTER COLLEGE PASHICHAM BAGH BAGHPAT",888,687,0,1575,511,368,0,879,879,0,7,759,78,24,1,0,0,1,0,1,1,0,0,5,2,879
11,"YAMUNA INTER COLLEGE BAGHPAT",451,395,0,846,333,259,0,592,514,0,19,9,10,542,1,0,0,8,0,1,0,0,0,0,2,592
12,"YAMUNA INTER COLLEGE BAGHPAT",737,624,0,1361,540,276,0,816,134,0,50,130,47,566,3,0,0,8,0,2,3,2,0,1,4,816
13,"YAMUNA INTER COLLEGE BAGHPAT",733,632,0,1365,485,425,0,910,906,0,37,320,26,509,1,0,0,10,0,1,2,0,1,1,2,910
14,"YAMUNA INTER COLLEGE BAGHPAT",940,732,0,1672,549,367,0,916,116,0,39,425,97,336,1,1,2,2,1,0,5,0,1,2,4,916
15,"KANYA JUNIOR HIGH SCHOOL BAGHPAT",534,499,0,1033,386,324,0,710,544,0,45,62,9,583,0,0,0,6,0,1,1,1,1,0,1,710
16,"ISLAMIYA MADRSA ASRAFUL ULOOM ROOM NO 1 BAGHPAT",565,317,0,882,383,161,0,544,544,0,38,329,165,0,0,0,1,0,1,1,0,1,0,6,2,544
17,"ISLAMIYA MADRSA ASRAFUL ULOOM ROOM NO 2 BAGHPAT",563,383,0,946,313,210,0,523,523,0,20,402,64,17,3,0,1,0,2,2,0,1,2,4,5,523
18,"ISLAMIYA MADRSA ASRAFUL ULOOM ROOM NO 3 BAGHPAT",530,341,0,871,337,173,0,510,376,0,10,401,40,49,0,1,0,4,0,1,0,0,2,1,1,510
19,"ISLAMIYA MADRSA ASRAFUL ULOOM ROOM NO 4 BAGHPAT",477,287,0,764,317,149,0,466,119,0,13,325,107,8,1,0,0,1,0,1,0,3,1,2,4,466
20,"PRIMARY PATHSHALA NO 2 ROOM NO 1 BAGHPAT",557,459,0,1016,412,322,0,734,734,0,7,258,28,435,1,0,0,1,0,1,1,1,0,1,0,734
21,"PRIMARY PATHSHALA NO 2 ROOM NO 2 BAGHPAT",487,383,1,871,390,292,0,682,676,0,10,349,28,282,0,0,0,4,0,0,2,3,0,1,3,682
22,"PRIMARY PATHSHALA NO 2 ROOM NO 3 BAGHPAT",620,473,0,1093,449,339,0,788,782,0,35,384,31,330,1,1,1,0,1,0,0,1,0,2,1,788
23,"BLOCK BILDING ROOM HOOL BAGHPAT",681,591,0,1272,455,362,0,817,667,0,49,145,164,428,0,0,0,26,0,0,3,1,0,1,0,817
24,"BLOCK BILDING UTTRE ROOM BAGHPAT",302,242,0,544,195,162,0,357,350,0,20,75,54,197,0,0,0,11,0,0,0,0,0,0,0,357
25,"D.A.V.PUBLIC SCHOOL ROOM NO1 MEERUT ROAD BAGHPAT",917,716,0,1633,590,436,0,1026,495,0,91,371,97,455,1,0,1,4,0,2,2,1,0,0,1,1026
26,"CHOPAL CHOHANAN UTTAR BAGHPAT",693,477,0,1170,567,387,0,954,947,0,8,186,28,723,1,0,1,0,1,0,1,0,1,1,3,954
27,"CHOPAL CHOHANAN DAKSHIN BAGHPAT",849,624,0,1473,583,433,0,1016,295,0,12,38,178,764,9,3,3,3,0,1,2,1,1,0,1,1016
28,"PRIMARY PATHSHALA EAST HAMIDABAD URF NAYA GANW",498,339,0,837,191,290,0,481,469,0,123,20,47,285,3,0,0,0,0,0,0,1,0,0,2,481
29,"PRIMARY PATHSHALA PASHICHAM HAMIDABAD URF NAYA GANW",783,550,0,1333,538,375,0,913,913,0,44,136,50,653,4,0,1,0,2,0,8,5,3,0,7,913
30,"VEDIC KANYA INTER COLLEGE ROOM NO 9 AGARWAL MANDI TATIRI",706,581,0,1287,530,395,0,925,825,0,54,102,56,699,3,0,0,1,0,0,3,3,1,0,3,925
31,"VEDIC KANYA INTER COLLEGE ROOM NO 13 AGARWAL MANDI TATIRI",810,624,0,1434,484,318,0,802,784,0,32,98,50,611,0,0,0,5,0,0,1,2,2,0,1,802
32,"VEDIC KANYA INTER COLLEGE ROOM NO 18 AGARWAL MANDI TATIRI",351,301,0,652,241,194,0,435,73,0,12,15,3,402,0,0,0,3,0,0,0,0,0,0,0,435
33,"VEDIC KANYA INTER COLLEGE ROOM NO 4 AGARWAL MANDI TATIRI",473,428,0,901,350,313,0,663,262,0,11,72,10,554,0,0,0,6,1,1,4,3,1,0,0,663
34,"D.A.V.INTER COLLEGE ROOM NO 5 AGARWAL MANDI TATIRI",653,552,0,1205,427,326,0,753,653,0,36,67,6,630,2,0,0,10,0,0,0,0,0,0,2,753
35,"D.A.V.INTER COLLEGE ROOM NO 6 AGARWAL MANDI TATIRI",704,563,0,1267,448,361,0,809,709,0,29,113,14,636,1,0,0,7,1,1,4,2,0,1,0,809
36,"D.A.V.INTER COLLEGE ROOM NO 7 AGARWAL MANDI TATIRI",649,551,0,1200,441,355,0,796,782,0,30,68,7,665,3,2,0,13,0,0,2,3,1,1,1,796
37,"RAVIDAS DHARMSHALA SCHOOL ROOM NO 1 AGARWAL MANDI TATIRI",894,739,0,1633,583,485,0,1068,870,0,17,52,619,360,1,0,1,1,0,0,1,3,3,1,9,1068
38,"RAVIDAS DHARMSHALA SCHOOL BRANDA ME AGARWAL MANDI TATIRI",400,332,0,732,263,204,0,467,460,0,13,5,260,169,0,1,0,11,0,0,2,1,0,2,3,467
39,"PURV MADHAYMIK VIDHALAYA ROOM NO 1 SURAJPUR MAHNWA",523,435,0,958,416,317,0,733,699,0,24,70,27,600,0,0,1,3,0,0,3,2,0,1,2,733
40,"PURV MADHAYMIK VIDHALAYA  ROOM NO 2 SURAJPUR MAHNWA",412,315,0,727,279,253,0,532,522,0,1,26,185,310,0,0,0,3,0,0,2,0,1,2,2,532
41,"PARIMARY PATHSHALA KASMABAD URF DUDBHA",313,245,0,558,214,150,0,364,345,0,6,3,25,327,1,0,0,0,0,0,0,0,1,0,1,364
42,"PARIMARY PATHSHALA PALI",874,651,0,1525,673,490,0,1163,1163,0,6,160,161,820,0,0,0,1,0,0,6,2,4,1,2,1163
43,"PARIMARY PATHSHALA NO1 EAST AHEDA",642,518,0,1160,475,398,0,873,855,0,31,56,452,306,2,0,0,4,1,2,4,5,6,3,1,873
44,"PARIMARY PATHSHALA NO1 PASHICHAM AHEDA",705,484,0,1189,512,312,0,824,790,0,8,16,483,280,2,0,0,5,1,2,5,4,4,2,12,824
45,"PARIMARY PATHSHALA  CHOHALDA",762,554,0,1316,639,446,0,1085,5,0,25,302,172,572,2,1,0,1,0,0,5,2,3,0,0,1085
46,"PARIMARY PATHSHALA NO1 UTTAR PAWLA BEGMABED",471,288,0,759,279,167,0,446,408,0,17,13,155,245,1,0,0,3,2,0,4,2,1,2,1,446
47,"PARIMARY PATHSHALA NO1 DAKSHIN  PAWLA BEGMABED",618,410,0,1028,343,212,0,555,533,0,9,27,202,305,1,0,0,1,0,2,5,0,1,1,1,555
48,"PARIMARY PATHSHALA NO2 ROOM NO1 PAWLA BEGMABED",508,369,0,877,304,222,0,526,477,0,6,76,111,308,3,0,2,6,0,3,7,2,1,1,0,526
49,"PARIMARY PATHSHALA NO2 ADD ROOM PAWLA BEGMABED",828,604,0,1432,568,350,0,918,883,0,18,9,264,603,4,2,0,1,0,0,7,5,0,1,4,918
50,"PARIMARY PATHSHALA SALAWATPUR KHERI",818,594,0,1412,590,410,0,1000,960,0,7,439,30,516,1,0,1,0,1,0,1,0,0,1,3,1000
51,"DEVNAGRI INTER COLLEGE DAKSHIN KHATTA PRAHLADPUR",640,499,0,1139,476,369,0,845,845,0,16,159,125,524,2,0,1,4,1,2,7,0,1,0,3,845
52,"DEVNAGRI INTER COLLEGE DAKSHIN KHATTA PRAHLADPUR",648,516,0,1164,482,362,0,844,244,0,9,17,25,772,7,0,1,1,0,0,5,4,1,0,2,844
53,"BARAT GHAR RIVIDAS MANDIR KHATTA PRAHLADPUR",750,600,0,1350,508,385,0,893,879,0,2,230,88,543,4,0,2,2,1,1,10,5,0,2,3,893
54,"PARIMARY PATHSHALA NO 1 UTTAR KHATTA PRAHLADPUR",475,392,0,867,310,227,0,537,500,0,4,29,137,357,0,0,0,2,0,0,3,4,0,0,1,537
55,"PRIMARY PATHSHALA NO 1 DAKSHIN KHATTA PRAHLADPUR",558,416,0,974,355,282,0,637,607,0,4,119,20,479,4,0,1,1,0,1,3,2,0,3,0,637
56,"PRIMARY PATHSHALA BASA TKRI",681,492,0,1173,458,297,0,755,727,0,10,172,72,480,1,0,0,0,0,0,7,5,4,1,3,755
57,"PRIMARY PATHSHALA NO2 PURV DOULA",744,638,0,1382,585,495,0,1080,7,0,35,519,135,360,4,1,0,1,1,2,4,5,2,8,3,1080
58,"PRIMARY PATHSHALA NO2 MADYA DOULA",629,541,0,1170,535,407,0,942,892,0,14,587,24,295,0,1,0,3,0,1,5,2,2,6,2,942
59,"PRIMARY PATHSHALA NO2 PASCHIM DOULA",568,488,0,1056,440,383,0,823,297,0,9,463,24,312,0,1,1,1,1,1,0,2,2,3,3,823
60,"AAGANWADI CANDR DOULA",573,401,0,974,439,290,0,729,721,0,5,84,5,625,0,0,0,0,0,0,2,6,0,0,2,729
61,"PRIMARY PATHSHALA UTTAR DOULA",577,427,0,1004,408,293,0,701,650,0,2,24,123,537,5,0,0,0,0,1,2,4,2,0,1,701
62,"PRIMARY PATHSHALA DAKSHIN DOULA",712,511,0,1223,484,333,0,817,816,0,9,307,205,271,8,0,1,2,1,2,3,1,2,3,2,817
63,"PRIMARY PATHSHALA AMARPUR GARHI MAJRA BASOUD",743,560,0,1303,585,439,0,1024,1020,0,34,399,13,556,2,0,0,1,0,0,3,8,3,4,1,1024
64,"PRIMARY PATHSHALA NO1 ROOM NO1 BASOUD",939,739,0,1678,629,482,0,1111,1111,0,32,887,96,59,2,0,0,0,0,1,2,3,5,10,14,1111
65,"PRIMARY PATHSHALA NO1 ROOM NO 2 BASOUD",948,603,0,1551,752,411,0,1163,1163,0,39,1036,36,41,1,0,0,2,0,0,1,1,0,2,4,1163
66,"PRIMARY PATHSHALA UTTAR GOSPUR",722,501,0,1223,486,456,0,942,142,0,12,910,6,6,0,0,0,2,0,0,0,1,0,2,3,942
67,"PRIMARY PATHSHALA DAKSHIN GOSPUR",634,504,0,1138,595,308,0,903,903,0,8,685,154,53,1,0,0,0,0,0,1,0,0,1,0,903
68,"PRIMARY PATHSHALA FATEHPUR",595,471,0,1066,360,299,0,659,1,0,46,2,210,382,4,2,0,0,0,0,2,6,1,1,3,659
69,"JUNIAR HIGH SCHOOL EAST BILOCHPURA",632,504,0,1136,353,258,0,611,600,0,107,321,156,19,2,0,1,0,0,2,0,0,0,2,1,611
70,"JUNIAR HIGH SCHOOL PASCHIM BILOCHPURA",830,618,0,1448,556,422,0,978,899,0,16,560,80,291,6,0,0,0,1,0,5,6,0,7,6,978
71,"PRIMARY PATHSHALA EAST BILOCHPURA",572,455,0,1027,398,293,0,691,690,0,47,513,10,106,5,0,0,0,0,2,0,1,2,3,2,691
72,"PRIMARY PATHSHALA PASCHIM BILOCHPURA",616,498,0,1114,450,322,0,772,766,0,29,369,12,350,3,0,0,0,0,2,2,1,0,1,3,772
73,"PRIMARY PATHSHALA  UTTAR KHINDODA",446,310,0,756,273,199,0,472,449,0,98,9,177,181,2,1,0,0,0,1,2,0,1,0,0,472
74,"PRIMARY PATHSHALA DAKSHIN KHINDODA",638,477,0,1115,376,270,0,646,643,0,24,138,88,391,1,0,0,0,0,0,1,1,0,2,0,646
75,"M.K. PRIMARY PATHSHALA KHINDODA",390,269,1,660,282,193,0,475,475,0,25,89,75,271,4,0,1,0,0,0,4,2,3,0,1,475
76,"PRIMARY PATHSHALA RAMNAGAR",655,520,0,1175,507,343,0,850,850,0,12,71,91,661,4,0,0,1,0,0,2,3,2,2,1,850
77,"PRIMARY PATHSHALA ROOM NO 1 TILPANI",573,454,0,1027,390,369,0,759,655,0,16,708,26,2,0,0,1,0,0,0,0,1,0,4,1,759
78,"PRIMARY PATHSHALA ROOM NO2 TILPANI",296,221,0,517,243,183,0,426,326,0,10,362,41,6,0,0,0,0,0,0,0,0,0,3,4,426
79,"PRIMARY PATHSHALA BARSIA",573,439,1,1013,464,278,0,742,742,0,9,390,207,110,6,0,0,0,1,1,4,3,3,2,6,742
80,"PRIMARY PATHSHALA LUHARA",798,632,0,1430,587,434,0,1021,1021,0,49,309,3,638,5,0,0,4,0,1,9,2,0,0,1,1021
81,"GODAMSAHKARI SAMITI ROOM NO 1 LUHARA",542,408,0,950,332,275,0,607,10,0,72,508,5,14,1,0,0,0,0,0,1,1,1,1,3,607
82,"GODAM SAHKARI SAMITI ROOM NO 2 LUHARA",484,322,0,806,284,215,0,499,478,0,96,181,166,43,2,0,1,0,0,1,2,1,4,1,1,499
83,"SHEEL CHAND INTER COLLEGE UTTER AMINAGAR SARAI",608,493,0,1101,399,320,0,719,719,0,76,265,3,367,0,2,0,0,0,0,2,1,0,0,3,719
84,"SHEEL CHAND INTER COLLEGE MADHYA  AMINAGAR SARAI",606,459,0,1065,435,288,0,723,719,0,79,73,16,532,1,3,0,2,0,1,8,4,0,1,3,723
85,"SHEEL CHAND INTER COLLEGE MADHYA BAGH AMINAGAR SARAI",689,569,0,1258,549,409,0,958,958,0,69,34,19,823,0,0,0,1,0,0,2,2,1,2,5,958
86,"SHEEL CHAND INTER COLLEGE DAKSHIN BAGH AMINAGAR SARAI",549,433,0,982,439,319,0,758,758,0,11,138,279,316,2,0,0,1,0,0,1,2,2,4,2,758
87,"PURV MADHYMIK VIDHYLAY UTTAR ROOM NO 1 AVINAGAR SARAI",514,486,1,1001,413,340,0,753,743,0,33,505,109,65,26,0,0,0,1,0,1,2,2,4,5,753
88,"PURV MADHYMIK VIDHYLAY UTTAR ROOM NO 2 AVINAGAR SARAI",326,299,0,625,237,216,0,453,3,0,18,353,31,40,7,0,0,1,0,1,0,0,0,0,2,453
89,"PURV MADHYMIK VIDHYLAY DAKSHIN  AVINAGAR SARAI",598,522,0,1120,421,354,0,775,630,0,30,334,15,370,18,0,0,4,0,1,0,0,0,1,2,775
90,"PRIMARY PATHSHALA PUTHAD",891,677,0,1568,529,411,0,940,764,0,55,487,87,295,2,0,0,10,0,0,1,0,1,1,1,940
91,"PRIMARY PATHSHALA EAST SADBHAR",481,371,0,852,311,231,0,542,542,0,17,122,11,381,1,0,1,1,0,0,2,1,1,1,3,542
92,"PRIMARY PATHSHALA PASCHIM SADBHAR",494,365,0,859,317,217,0,534,530,0,4,216,49,256,0,1,1,1,0,0,1,1,0,1,3,534
93,"PRIMARY PATHSHALA NO 2 UTTAR SADBHAR",594,439,0,1033,376,274,0,650,540,0,6,241,10,158,230,0,1,0,1,0,0,0,0,3,0,650
94,"PRIMARY PATHSHALA NO2 DAKSHIN SANAD BHAR",457,350,0,807,281,216,0,497,390,0,8,87,192,181,19,0,2,0,2,0,1,2,2,0,1,497
95,"NETAJI SUBHASH SMARK SCHOOL UTTAR BUDHSENI",623,486,0,1109,357,257,0,614,612,0,16,235,12,333,2,1,0,0,1,0,4,2,0,5,3,614
96,"NETAJI SUBHASH SMARK SCHOOL DAKSHIN BUDHSENI",561,450,0,1011,310,319,0,629,529,0,10,78,27,491,4,0,1,0,0,1,6,8,1,2,0,629
97,"PRIMARY PATHSHALA UTTAR MATANAT NAGAR",481,363,0,844,348,282,0,630,395,0,333,128,5,152,2,1,0,0,1,0,2,1,1,0,4,630
98,"PRIMARY PATHSHALA DAKSHIN MATANAT NAGAR",474,358,0,832,327,249,0,576,572,0,230,43,70,207,4,2,1,0,0,0,7,2,0,3,7,576
99,"JUNIAR HIGH SCHOOL MAVI KHURD",564,417,0,981,366,249,0,615,615,0,176,195,86,149,0,0,0,0,0,1,2,0,0,3,3,615
100,"PRIMARY PATHSHALA UTTAR PURA",563,420,0,983,460,303,0,763,590,0,503,44,1,200,0,2,0,2,0,1,2,1,0,0,7,763
101,"PRIMARY PATHSHALA DAKSHIN PURA",368,271,1,640,260,187,0,447,350,0,54,42,201,135,1,0,1,1,0,1,7,1,2,0,1,447
102,"PRIMARY PATHSHALA SHAHJAHANPUR TISHOTRA URF NAVADA",446,377,0,823,266,229,0,495,70,0,23,112,115,232,2,0,0,7,0,0,2,1,0,0,1,495
103,"PRIMARY PATHSHALA UTTAR HARIYA KHEDA",526,354,0,880,371,245,0,616,613,0,4,356,19,232,2,0,0,1,0,0,1,0,0,0,1,616
104,"PRIMARY PATHSHALA DAKSHIN HARIYA KHEDA",485,383,0,868,347,238,0,585,312,0,4,225,46,297,3,0,0,1,0,0,4,2,2,1,0,585
105,"SHRI KRISHNA INTER COLLEGE ROOM NO 1 AMIPUR BALENI",713,587,0,1300,429,333,0,762,500,0,11,200,82,448,2,1,1,1,0,0,10,0,1,3,2,762
106,"SHRI KRISHNA INTER COLLEGE ROOM NO 2 AMIPUR BALENI",606,515,0,1121,370,324,0,694,334,0,5,236,17,421,3,0,0,1,0,0,6,1,0,0,4,694
107,"SHRI KRISHNA INTER COLLEGE ROOM NO 3 AMIPUR BALENI",643,596,0,1239,404,382,0,786,784,0,13,335,49,376,2,0,0,4,0,0,2,2,0,0,3,786
108,"PRIMARY PATHSHALA BAKHRPUR BALINI",472,376,0,848,310,241,0,551,151,0,7,243,19,279,0,0,0,0,0,0,1,1,1,0,0,551
109,"SAMUDAYIK VIKAS CANDER BAKHRPUR BALENI",421,355,0,776,258,229,0,487,487,0,2,250,95,136,0,0,0,1,0,0,0,1,0,1,1,487
110,"PRIMARY PATHSHALA UTTAR HABIBPUR BALENI",407,347,0,754,253,202,0,455,364,0,10,215,79,142,1,0,0,2,1,1,3,1,0,0,0,455
111,"PRIMARY PATHSHALA DAKSHIN HABIBPUR NANGLA",531,391,0,922,319,241,0,560,460,0,5,169,221,153,0,0,0,2,0,0,4,0,2,1,3,560
112,"PRIMARY PATHSHALA NO 1 SINGHAWLI AHIR",726,558,0,1284,475,331,0,806,16,0,5,408,7,364,4,0,0,13,0,0,4,0,0,0,1,806
113,"DHRAMSHALA MADYA SINGHAWLI AHIR",393,313,0,706,284,214,0,498,27,0,17,301,6,166,3,0,0,1,0,1,1,0,0,1,1,498
114,"DHRAMSHALA MADYA SINGHAWLI AHIR",421,332,0,753,305,228,0,533,530,0,4,362,12,149,0,1,0,3,0,0,0,0,0,0,2,533
115,"DHRAMSHALA DAKSHIN SINGHAWLI AHIR",548,434,0,982,362,275,0,637,37,0,11,360,8,245,0,1,0,3,0,0,4,2,2,1,0,637
116,"DHRAMSHALA DAKSHIN SINGHAWLI AHIR",391,317,0,708,278,198,0,476,34,0,4,301,1,166,0,0,0,0,0,1,1,0,1,1,0,476
117,"PRIMARY PATHSHALA NO 2 SINGHAWLI AHIR",600,471,0,1071,416,302,0,718,633,0,1,61,320,329,0,1,0,4,0,0,1,1,0,0,0,718
118,"PRIMARY PATHSHALA SHOBHAPUR MAJRA HISAWDA",463,349,0,812,309,248,0,557,557,0,14,7,115,418,0,0,0,0,0,0,1,0,0,0,2,557
119,"HARIJAN CHOPAL HISAWDA",796,651,2,1449,467,450,0,917,912,0,91,44,261,477,4,0,0,2,2,2,7,6,9,5,7,917
120,"PRIMARY PATHSHALA EAST HISAWDA",628,464,0,1092,434,250,0,684,684,0,352,34,1,286,0,0,0,1,1,1,3,2,1,0,2,684
121,"PRIMARY PATHSHALA PASCHIM HISAWDA",751,634,0,1385,528,411,0,939,449,0,229,210,24,447,3,1,0,1,0,2,9,8,0,3,2,939
122,"PRIMARY PATHSHALA RATANPURI",202,157,0,359,139,114,0,253,220,0,2,9,25,215,0,0,0,0,0,0,0,2,0,0,0,253
123,"NEHRU SMARK INTER COLLEGE UTTAR PILANA",637,476,0,1113,454,290,0,744,733,0,8,79,218,407,0,0,0,0,0,4,10,5,7,3,3,744
124,"NEHRU SMARK INTER COLLEGE DAKSHIN PILANA",458,360,0,818,313,240,0,553,552,0,5,11,23,505,0,0,0,2,0,0,5,1,0,0,1,553
125,"PRIMARY PATHSHALA UTTAR PILANA",432,350,0,782,307,234,0,541,511,0,8,89,33,406,2,0,0,0,0,1,0,1,0,1,0,541
126,"PRIMARY PATHSHALA DAKSHIN PILANA",649,488,0,1137,340,256,0,596,584,0,14,100,36,440,4,0,0,1,0,0,1,0,0,0,0,596
127,"PRIMARY PATHSHALA UTTAR RASULPUR SANKALPUTTHI",583,426,0,1009,399,271,0,670,550,0,343,50,27,225,7,0,0,2,1,1,4,5,1,0,4,670
128,"PRIMARY PATHSHALA DAKSHIN RASULPUR SANKALPUTTHI",519,348,0,867,391,257,0,648,633,0,491,3,84,63,0,1,0,0,0,0,0,0,2,0,4,648
129,"PRIMARY PATHSHALA ABDULLAPUR MEWLA",458,359,0,817,423,263,0,686,686,0,10,146,28,486,6,0,5,0,0,1,2,0,0,0,2,686
130,"PRIMARY PATHSHALA SIKHEEDA",616,470,0,1086,484,348,0,832,232,0,602,62,38,108,0,1,0,14,0,1,0,0,0,0,6,832
131,"PRIMARY PATHSHALA PATOULI",316,232,0,548,231,142,0,373,6,0,255,25,11,79,0,0,0,2,0,0,0,0,0,0,1,373
132,"PRIMARY PATHSHALA DOLATPUR",573,431,1,1005,367,287,0,654,154,0,9,246,158,216,9,1,0,0,0,0,0,4,1,5,5,654
133,"JUNIOR HIGH SCHOOL MURADGAON URF ROSHANGARH",687,516,0,1203,419,277,0,696,595,0,69,389,15,200,4,0,0,0,0,0,1,1,2,4,11,696
134,"JUNIOR HIGH SCHOOL MURADGAON URF ROSHANGARH",563,469,0,1032,396,352,0,748,18,0,12,273,82,346,1,0,2,4,3,2,9,4,2,3,5,748
135,"PRIMARY PATHSHALA SAIDPUR URF NATHMALPUR",284,257,0,541,211,188,0,399,399,0,302,1,2,81,0,0,0,10,0,0,0,1,0,0,2,399
136,"PRIMARY PATHSHALA MUKANDPUR OGTI",429,316,0,745,270,171,0,441,237,0,198,5,15,209,0,0,0,5,0,0,2,2,1,1,3,441
137,"ADARSH BHARTIYA CHANDRLAL U.M.V. LATIFPUR DATNAGAR",453,303,0,756,404,257,0,661,100,0,20,133,17,483,3,0,0,1,0,0,2,1,0,0,1,661
138,"PRIMARY PATHSHALA ROOM NO 1 LATIFPUR DUTT DATNAGAR",496,372,0,868,397,267,0,664,664,0,2,79,75,489,2,1,0,8,0,0,4,1,1,1,1,664
139,"PRIMARY PATHSHALA ROOM NO 2 LATIFPUR DUTT DATNAGAR",450,315,0,765,367,223,0,590,68,0,3,64,26,484,1,0,0,5,1,0,3,2,0,0,1,590
140,"PRIMARY PATHSHALA GHATOLI",769,637,0,1406,514,422,0,936,92,0,25,137,323,438,3,2,0,0,0,1,0,2,1,1,3,936
141,"DEV INTER COLLEGE UTTAR DOLCHA",761,672,0,1433,479,418,0,897,892,0,3,325,82,459,4,0,1,6,1,0,7,3,0,2,4,897
142,"DEV INTER COLLEGE DAKSHIN  DOLCHA",762,613,0,1375,436,424,0,860,620,0,22,342,136,353,0,0,0,2,0,0,3,2,0,0,0,860
143,"PRIMARY PATHSHALA DOLCHA",673,539,0,1212,442,304,0,746,733,0,16,396,25,287,0,1,0,3,0,3,6,2,1,2,4,746
144,"PRIMARY PATHSHALA NO 2 UTTAR MUKARI",518,349,0,867,367,221,0,588,563,0,12,3,19,537,2,0,0,0,0,1,8,3,0,1,2,588
145,"PRIMARY PATHSHALA NO 2 DAKSHIN MUKARI",517,378,0,895,328,223,0,551,200,0,13,139,110,281,0,0,0,1,0,2,0,0,2,2,1,551
146,"PRIMARY PATHSHALA MUKARI",471,351,0,822,331,221,0,552,531,0,31,82,53,368,4,1,0,1,0,1,3,3,0,0,5,552
147,"PRIMARY PATHSHALA HARSIYA",162,127,0,289,133,90,0,223,120,0,9,10,37,155,1,0,2,1,0,0,4,1,1,1,1,223
148,"PRIMARY PATHSHALA KAHRKA",718,529,0,1247,420,298,0,718,584,0,31,95,22,550,3,0,0,8,0,1,5,3,0,0,0,718
149,"HIGH SCHOOL EAST CHAMRAWAL",751,527,0,1278,439,277,0,716,26,0,74,39,74,504,2,1,0,2,0,0,6,5,1,1,7,716
150,"HIGH SCHOOL PASCHIM CHAMRAWAL",676,475,0,1151,474,270,0,744,500,0,100,59,177,395,3,1,0,1,1,0,5,0,1,0,1,744
151,"PRIMARY PATHSHALA KHASPUR",183,155,0,338,163,110,0,273,208,0,11,0,19,239,1,0,0,0,0,0,2,0,1,0,0,273
152,"PRIMARY PATHSHALA EAST PANCHI",745,572,0,1317,505,399,0,904,901,0,94,420,52,323,1,0,0,2,1,1,5,1,0,2,2,904
153,"PRIMARY PATHSHALA PASCHIM PANCHI",614,483,0,1097,430,366,0,796,795,0,22,468,0,297,1,0,0,1,0,1,3,0,0,1,2,796
154,"M.G.M.INTER COLLEGE MADHA DHIKOLI",623,420,0,1043,458,228,0,686,684,0,397,43,27,202,0,0,0,7,0,1,2,1,1,2,3,686
155,"M.G.M.INTER COLLEGE MADHA DHIKOLI",661,479,0,1140,454,311,0,765,765,0,424,75,10,217,1,0,0,20,0,0,4,0,3,2,9,765
156,"PRIMARY PATHSHALA NO 2 UTTAR DHIKOLI",485,283,0,768,358,195,0,553,546,0,333,2,2,86,0,0,0,125,0,1,1,0,0,1,2,553
157,"PRIMARY PATHSHALA NO 2 DAKSHIN DHIKOLI",545,354,0,899,389,220,0,609,600,0,420,30,8,97,0,0,0,52,0,0,1,0,0,0,1,609
158,"PRIMARY PATHSHALA NO 3  DHIKOLROOM NO 1",525,389,0,914,460,271,0,731,700,0,567,4,2,145,1,0,0,6,0,1,1,1,0,1,2,731
159,"PRIMARY PATHSHALA NO 3 ROOM  NO0 2 DHIKOLI",525,376,0,901,449,295,0,744,432,0,528,27,4,145,1,0,0,34,0,1,0,0,0,2,2,744
160,"KANYA  JUNIOR HIGH SCHOOL DHIKOLI",638,389,0,1027,467,240,0,707,600,0,530,29,7,111,1,0,0,24,0,0,0,0,1,1,3,707
161,"JATAV DHARMSHALA DHIKOLI",292,249,0,541,122,100,0,222,174,0,74,3,87,25,1,0,1,21,1,1,1,0,4,1,2,222
162,"PRIMARI PATHSHALA MEHARMPUR",404,270,0,674,319,173,0,492,492,0,4,13,130,337,1,0,0,3,0,0,3,1,0,0,0,492
163,"PRIMARI PATHSHALA SAIDPUR KALA",390,323,0,713,299,238,0,537,527,0,59,27,103,331,0,0,1,6,0,0,4,4,2,0,0,537
164,"JANTA INTER COLLEGE UTTER BASI",678,486,0,1164,456,286,0,742,206,0,292,15,22,404,1,1,0,0,0,2,1,2,2,0,0,742
165,"JANTA INTER COLLEGE DAKSHIN BASI",730,562,0,1292,525,324,0,849,744,0,392,12,5,432,0,0,0,1,0,0,3,2,0,1,1,849
166,"JANTA INTER COLLEGE MADHYA BASI",801,595,0,1396,508,335,0,843,57,0,384,2,29,400,1,0,0,0,1,3,10,6,2,0,5,843
167,"HARIJAAN CHOPAL  ADD BASI",610,469,0,1079,419,291,0,710,706,0,213,129,95,261,3,0,0,3,1,0,1,2,0,1,1,710
168,"PRIMARY PATHSHALA ROOM NO1 SUNHEDA",755,614,0,1369,520,374,0,894,894,0,458,48,16,360,4,0,0,5,0,0,0,1,0,0,2,894
169,"PRIMARY PATHSHALA ROOM NO2 SUNHEDA",787,578,0,1365,503,365,0,868,868,0,205,22,53,573,3,3,0,3,0,0,2,1,2,0,1,868
170,"TEMPRELI POOLING BOUTH HARIJAN CHOPAL SUNHEDA",742,538,0,1280,515,347,0,862,862,0,115,151,183,397,1,0,0,1,0,1,5,0,0,1,7,862
171,"PRIMARY PATHSHALA ANANDPUR URF BANDPUR",727,551,0,1278,556,380,0,936,912,0,431,4,103,377,2,0,0,1,1,4,3,3,2,0,5,936
172,"PRIMARY PATHSHALA HARCHADPUR",861,540,0,1401,606,429,0,1035,947,0,18,623,258,124,0,0,0,2,0,0,1,2,0,2,5,1035
173,"HARIJAN CHOPAL ADD KATHA",776,536,0,1312,507,350,0,857,26,0,108,5,563,136,0,0,0,7,0,3,2,5,15,7,6,857
174,"PRIMARY PATHSHALA ROOM NO 1 KATHA",657,533,3,1193,422,354,0,776,630,0,419,4,12,323,4,1,1,0,0,0,5,3,1,1,2,776
175,"PRIMARY PATHSHALA ROOM NO 2 KATHA",926,642,0,1568,613,347,0,960,940,0,462,286,26,157,1,1,0,3,0,3,6,6,1,2,6,960
176,"PRIMARY PATHSHALA ROOM NO 3 KATHA",701,529,0,1230,540,322,0,862,830,0,637,7,12,200,3,0,0,0,0,1,1,0,1,0,0,862
177,"PRIMARY PATHSHALA NANGLA BAHALOLPUR",331,274,0,605,211,185,0,396,220,0,15,79,39,258,0,0,0,4,0,0,1,0,0,0,0,396
178,"KISHAN INTER COLLEGE UTTER MAVIKALA",565,449,0,1014,442,352,0,794,294,0,450,0,5,317,4,1,2,8,1,1,1,1,0,0,3,794
179,"KISHAN INTER COLLEGE DAKSIN MAVIKALA",444,367,0,811,410,281,0,691,691,0,473,5,1,206,1,0,0,3,0,0,1,1,0,0,0,691
180,"A0 DACHA AMER SINGH KE GHRE KE PASS MAVIKALA",557,410,0,967,426,267,0,693,683,0,79,146,227,216,3,0,0,4,0,2,11,0,1,0,4,693
181,"A0 DACHA AMER SINGH KE GHRE KE PASS MAVIKALA",436,338,0,774,373,250,0,623,400,0,81,288,19,229,2,0,0,0,0,1,2,1,0,0,0,623
182,"JAIN INTER COLLEGE EAST KHEKRA",694,589,0,1283,474,340,0,814,750,0,182,59,39,524,2,0,0,4,0,0,1,0,1,0,2,814
183,"JAIN INTER COLLEGE WEST KHEKRA",807,674,0,1481,526,419,0,945,923,0,243,164,10,515,1,0,0,3,0,1,1,1,2,0,4,945
184,"JAIN INTER COLLEGE MADYA ROOM NO 8 KHEKRA",794,683,0,1477,495,403,0,898,730,0,199,192,159,333,0,0,0,4,3,0,2,1,2,2,1,898
185,"JAIN INTER COLLEGE MADYA ROOM NO 10  KHEKRA",514,367,0,881,372,243,0,615,215,0,75,351,7,171,6,1,0,1,0,0,0,0,1,1,1,615
186,"KASTURBA KANYA INTER COLLEGEROOM NO1  KHEKRA",543,387,0,930,314,223,0,537,396,0,130,275,10,102,3,0,3,2,0,1,0,0,0,5,6,537
187,"KASTURBA KANYA INTER COLLEGE ROOM NO2  KHEKRA",398,340,0,738,216,178,0,394,328,0,23,29,68,268,0,1,0,0,0,0,1,1,3,0,0,394
188,"KANYA JUNIAR HIGH SCHOOL ROOM NO 1 KHEKRA",537,457,0,994,398,296,0,694,472,0,181,8,23,461,0,0,0,7,0,0,6,5,2,0,1,694
189,"KANYA JUNIAR HIGH SCHOOL ROOM NO 2 KHEKRA",481,389,0,870,340,264,0,604,431,0,265,3,14,300,0,0,0,13,0,0,5,1,1,1,1,604
190,"KANYA JUNIOR HIGH SCHOOL DAKSIN KHEKRA",814,642,0,1456,597,342,0,939,939,0,540,6,14,354,0,1,0,6,1,3,3,0,1,5,5,939
191,"KANYA JUNIOR HIGH SCHOOL K.NO.-5 KHEKRA",844,652,0,1496,476,352,0,828,700,0,94,490,32,139,58,1,0,6,1,0,1,2,1,2,1,828
192,"KANYA JUNIOR HIGH SCHOOL K.NO.-6 KHEKRA",428,317,0,745,252,202,0,454,451,0,12,347,24,47,9,2,0,0,0,1,1,3,0,2,6,454
193,"GANDHI INTER COLLEGE KHEHRA",556,467,0,1023,340,244,0,584,408,0,136,25,36,380,1,0,0,4,0,0,1,0,0,1,0,584
194,"HARIJAN CHOPAL PURAB KHEKRA",670,549,0,1219,411,311,0,722,222,0,5,18,529,134,0,0,0,30,0,0,1,1,3,0,1,722
195,"HARIJAN CHOPAL JATAV PURAB KHEKRA",516,422,0,938,326,254,0,580,500,0,5,174,322,62,1,0,0,3,0,0,1,5,4,1,2,580
196,"HARIJAN CHOPAL JATAV PASCHIM KHEKRA",475,379,0,854,306,242,0,548,541,0,1,6,430,102,1,0,0,3,0,1,0,0,2,1,1,548
197,"SAHEED DHARMVIR SINGH PARISADIY PURV MADYAMIK VIDHALYA",730,551,0,1281,251,504,0,755,755,0,23,203,7,494,7,0,2,7,0,0,5,2,1,1,3,755
198,"SAHEED DHARMVIR SINGH PARISADIY PURV MADYMIK VIDHALYA",475,376,0,851,305,194,0,499,99,0,8,154,12,308,3,0,1,6,0,1,2,2,0,0,2,499
199,"M.M.I.C.UTTER  KHEKRA",518,438,0,956,326,278,0,604,600,0,10,223,11,343,3,0,0,7,0,0,4,2,0,0,1,604
200,"M.M.I.C. UTTER KHEKRA",791,672,0,1463,518,346,0,864,804,0,10,644,26,127,26,1,0,4,2,1,6,0,0,2,15,864
201,"PRATHMIK VIDYALAYA NO.-5 K.NO.-1 KHEKRA",809,535,0,1344,516,297,0,813,808,0,23,325,14,431,1,0,0,3,0,2,7,4,0,0,3,813
202,"PRATHMIK VIDYALAYA NO.-5 K.NO.-2 KHEKRA",807,589,0,1396,458,402,0,860,620,0,365,171,16,293,5,1,0,5,0,0,0,0,1,1,2,860
203,"PRATHMIK VIDYALAYA NO.-5 K.NO.-3 KHEKRA",736,523,0,1259,487,351,0,838,837,0,162,195,63,379,7,3,2,0,1,3,17,2,0,2,2,838
204,"PRATHMIK VIDYALAYA NO.-5 K.NO.-4 KHEKRA",424,296,1,721,277,177,0,454,320,0,152,73,18,192,4,1,0,1,1,2,7,1,0,0,2,454
205,"M.M.DEGREE.C. K. NO.-1 KHEKRA",910,683,0,1593,503,325,0,828,800,0,407,58,16,335,2,1,0,3,1,1,2,1,0,0,1,828
206,"M.M.DEGREE.C. K. NO.-2 KHEKRA",704,490,1,1195,431,192,0,623,614,0,217,128,18,247,0,0,0,1,0,0,4,2,1,0,5,623
207,"M.M.DEGREE.C. K. NO.-3 KHEKRA",293,236,0,529,196,147,0,343,318,0,164,27,4,143,0,0,0,1,0,1,3,0,0,0,0,343
208,"CHOPAL PATTY SHAHJAHAPUR KHEKRA",599,453,0,1052,448,318,0,766,744,0,3,297,148,305,0,0,0,3,0,1,4,1,2,1,1,766
209,"JUNIOR HIGH SCHOOL UTTER SANKROD",707,544,0,1251,534,370,0,904,204,0,402,15,9,428,35,1,0,0,1,2,4,2,1,1,3,904
210,"JUNIOR HIGH SCHOOL DAKSHIN SANKROD",588,464,0,1052,436,315,0,751,560,0,482,65,5,193,1,0,0,1,0,0,1,0,0,1,2,751
211,"HARIJAN CHOPAL ATTI SANKROD",629,494,0,1123,494,301,0,795,23,0,50,391,13,205,108,4,0,3,1,3,6,2,2,2,5,795
212,"VALMIKI CHOPAL ATTI SANKROD",439,329,0,768,344,240,0,584,34,0,21,85,347,113,8,0,1,1,0,1,0,0,4,3,0,584
213,"PRIMARY PATHSHALA SUBHANPUR",505,393,0,898,388,256,0,644,642,0,60,12,88,457,0,1,0,9,0,4,3,4,2,1,3,644
214,"PRIMARY PATHSHALA  NO. 2 NAYA SUBHANPUR",311,250,0,561,231,179,0,410,394,0,38,31,123,204,1,0,0,6,1,0,4,0,1,0,1,410
215,"PRIMARY PATHSHALA NURPUR MUJBITA",627,408,0,1035,474,291,0,765,758,0,14,8,474,247,4,1,0,2,0,1,2,2,6,2,2,765
216,"PRIMARY PATHSHALA ABDULLPUR NURPUR KHALSA",290,226,0,516,213,152,0,365,359,0,19,2,25,314,2,0,0,0,0,0,2,0,0,1,0,365
