217,"PRIMARY PATHSHALA JAHANGIRPUR  URF DUNDAHERA",378,280,0,658,302,200,0,502,502,0,7,20,86,380,1,0,0,1,0,1,1,3,0,1,1,502
218,"PRIMARY PATHSHALA HASANPUR MASOORI",658,474,0,1132,470,350,0,820,770,0,23,283,167,332,1,0,0,1,1,0,7,2,1,0,2,820
219,"AMBEDKAR VIDYALAYA FAKARPUR  MO. SHAHPUR",650,491,0,1141,452,315,0,767,756,0,472,1,107,182,1,0,0,1,0,1,1,1,0,0,0,767
220,"AMBEDKAR VIDYALAYA FAKARPUR  MO. SHAHPUR",403,317,0,720,337,211,0,548,407,0,280,18,15,226,0,0,0,5,0,0,2,0,0,0,2,548
221,"PRIMARY PATHSHALA UTTER FAKHARPUR MO. SHAHPUR",630,464,0,1094,596,275,0,871,452,0,515,41,40,269,2,0,0,0,0,0,2,1,0,0,1,871
222,"PRIMARY PATHSHALA DAKSHIN FAKHARPUR MO. SHAHPUR",404,291,0,695,283,191,0,474,445,0,253,1,138,74,0,0,1,0,0,1,0,1,3,0,2,474
223,"PRIMARY PATHSHALA UTTER FIROJPUR",560,422,0,982,366,280,0,646,641,0,4,27,98,495,2,0,0,12,1,0,3,1,1,2,0,646
224,"PRIMARY PATHSHALA DAKSHIN FIROJPUR",409,345,0,754,338,227,0,565,165,0,7,19,50,481,1,0,0,2,0,0,3,0,1,1,0,565
225,"PRIMARY PATHSHALA NOROJPUR EMMA",447,330,0,777,376,239,0,615,615,0,417,2,8,183,0,0,0,0,0,0,1,0,1,0,3,615
226,"PRIMARY PATHSHALA UTTER MUBARRIKPUR",706,512,0,1218,510,325,0,835,235,0,14,98,56,657,2,1,0,2,0,0,3,0,1,0,1,835
227,"PRIMARY PATHSHALA DAKSHIN MUBARRIKPUR",556,425,0,981,485,277,0,762,162,0,19,172,105,443,13,0,1,3,1,1,1,0,2,1,0,762
228,"PRIMARY PATHSHALA UTTER RAVAN URF BADAGAON",463,333,0,796,321,230,0,551,551,0,8,34,47,450,1,0,0,5,0,0,3,1,1,1,0,551
229,"PRIMARY PATHSHALA DAKSHIN RAVAN URF BADAGAON",332,244,0,576,249,168,0,417,400,0,7,2,64,341,1,0,0,0,0,0,1,0,0,0,1,417
230,"KANYA PRIMARY PATHSHALA RAVAN URF BADAGAON",526,403,0,929,383,280,0,663,480,0,15,108,251,280,2,0,0,0,0,1,2,0,2,1,1,663
231,"PANCHAYAT GHAR RAVAN URF BADAGAON",670,506,0,1176,455,306,0,761,654,0,32,265,90,362,1,0,0,2,0,0,5,2,0,1,1,761
232,"PRIMARY PATHSHALA KHAILA",763,554,0,1317,464,341,0,805,365,0,42,7,203,533,1,1,0,1,0,0,4,6,3,3,1,805
233,"PRIMARY PATHSHALA MANSOORPUR",681,445,0,1126,491,294,0,785,35,0,519,35,41,168,1,2,0,6,0,2,2,2,2,3,2,785
234,"SAINT JO. JUNIOR HIGH SCHOOL LALIYANA",750,582,0,1332,464,354,0,818,130,0,56,508,130,110,1,0,0,1,0,1,1,2,4,0,4,818
235,"PRIMARY PATHSHALA LALIYANA",729,528,0,1257,498,319,0,817,816,0,443,7,22,327,0,0,1,2,3,1,4,1,0,2,4,817
236,"PRIMARY PATHSHALA SAHWANPUR",350,295,0,645,231,203,0,434,109,0,8,341,4,75,0,0,0,1,0,1,1,2,0,0,1,434
237,"PRIMARY PATHSHALA UTTER LAHCHORA",606,463,1,1070,410,263,0,673,29,0,31,139,35,418,4,0,2,39,0,0,2,2,0,0,1,673
238,"PRIMARY PATHSHALA DAKSHIN LAHCHORA",397,323,0,720,241,176,0,417,409,0,29,42,78,245,1,0,0,15,0,0,0,4,2,1,0,417
239,"ROHTASH JUNIOR HIGH SCHOOL NO. 1 GONA",577,430,0,1007,405,282,0,687,5,0,39,519,7,109,0,0,0,2,1,0,0,0,1,6,3,687
240,"ROHTASH JUNIOR HIGH SCHOOL NO. 2 GONA",621,509,1,1131,412,326,0,738,733,0,10,186,112,415,1,0,0,7,0,0,3,1,0,0,3,738
241,"SAINT MERRY INTER COLLEGE  K- NO. 1 RATOL",528,360,0,888,446,238,0,684,340,0,5,559,20,92,0,0,0,0,0,0,1,1,1,2,3,684
242,"SAINT MERRY INTER COLLEGE  K- NO. 3 RATOL",594,421,0,1015,441,319,0,760,82,0,9,676,52,6,0,0,0,1,0,0,1,1,2,3,9,760
243,"SAINT MERRY INTER COLLEGE  K- NO. 2 RATOL",487,376,0,863,339,227,0,566,536,0,52,452,38,19,1,0,0,2,0,0,0,0,1,0,1,566
244,"SAINT MERRY INTER COLLEGE  K- NO.4 RATOL",476,360,0,836,322,222,0,544,540,0,15,322,88,110,1,2,1,2,0,0,1,0,1,1,0,544
245,"PRIMARY PATHSHALA NO. 2 K. NO.-1 RATOL",587,398,0,985,408,287,0,695,695,0,87,395,9,192,0,0,0,2,0,1,3,0,1,3,2,695
246,"PRIMARY PATHSHALA NO. 2 K. NO.-4 RATOL",433,346,0,779,347,248,0,595,595,0,2,454,46,87,0,0,0,1,1,0,0,0,0,0,4,595
247,"PRIMARY PATHSHALA NO. 2 K. NO.-2 RATOL",510,376,0,886,357,233,0,590,590,0,81,386,16,96,1,0,2,1,0,0,3,0,2,1,1,590
248,"PRIMARY PATHSHALA NO. 2 K. NO.-3 RATOL",525,359,0,884,401,266,0,667,8,0,17,524,92,20,1,1,1,1,0,0,0,1,2,1,6,667
249,"SAINT MERRY PRIMARY SCHOOL  K- NO. 1 RATOL",737,637,1,1375,552,368,0,920,919,0,69,783,7,55,0,0,0,1,0,1,0,0,1,1,2,920
250,"SAINT MERRY PRIMARY SCHOOL  K- NO. 2 RATOL",599,418,0,1017,377,228,0,605,500,0,19,372,153,50,1,1,3,0,0,1,1,0,1,2,1,605
251,"SAINT MERRY PRIMARY SCHOOL  K- NO. 3 RATOL",421,355,0,776,313,245,0,558,558,0,22,335,141,49,0,0,0,3,0,0,0,0,2,3,3,558
252,"PRIMARY PATHSHALA NAGLABADHI",534,406,0,940,486,343,0,829,829,0,751,4,4,68,1,0,0,0,0,0,0,0,0,1,0,829
253,"HARIJAN CHOPAL ATTI NAGLABADHI",567,422,0,989,352,260,0,612,609,0,274,3,228,87,2,2,1,8,0,2,1,0,2,0,2,612
254,"PRIMARY PATHSHALA AHMADNAGAR",667,479,0,1146,400,240,0,640,615,0,15,73,227,312,0,2,0,0,0,1,4,5,1,0,0,640
255,"PRIMARY PATHSHALA NO. 2 K. NO.-1 GOTHRA",832,609,0,1441,500,346,0,846,646,0,51,15,285,457,2,0,2,4,1,0,13,0,5,2,9,846
256,"PRIMARY PATHSALA NO. 2 K. NO.-2 GOTHRA",587,460,0,1047,384,249,0,633,433,0,45,7,126,440,4,1,0,0,0,1,3,2,2,0,2,633
257,"PRIMARY PATHSHALA PURAB GHITORA",580,403,0,983,416,201,0,617,617,0,12,6,216,373,2,0,0,2,2,0,1,0,0,0,3,617
258,"PRIMARY PATHSHALA PASCHIM GHITORA",629,446,0,1075,411,230,0,641,578,0,23,5,207,385,3,0,0,11,0,1,2,0,3,0,1,641
259,"JUNIOR HIGH SCHOOL K. NO. -1 GHITORA",559,447,0,1006,373,260,0,633,573,0,48,6,246,306,1,1,0,16,0,0,3,1,3,1,1,633
260,"JUNIOR HIGH SCHOOL K. NO. -2 GHITORA",569,452,0,1021,405,241,0,646,640,0,15,8,267,347,0,0,0,0,0,0,1,4,3,0,1,646
261,"PRIMARY PATHSHALA TIGARI",389,316,0,705,225,173,0,398,388,0,19,15,117,229,2,0,1,2,1,2,4,1,3,1,1,398
262,"PRIMARY PATHSHALA PURAB DAGARPUR",521,395,0,916,335,208,0,543,543,0,74,2,82,368,2,2,1,6,0,0,1,1,1,1,2,543
263,"PRIMARY PATHSHALA PACHIM DAGARPUR",504,392,0,896,334,208,0,542,542,0,8,4,162,337,0,0,1,23,0,1,3,0,1,0,2,542
264,"KANYA PRIMARY PATHSHALA  DAGARPUR",360,271,0,631,232,146,0,378,362,0,37,3,65,255,0,0,0,14,1,0,2,1,0,0,0,378
265,"PRIMARY PATHSHALA VINAYPUR",668,438,0,1106,483,285,0,768,698,0,69,187,214,281,3,0,0,1,0,1,5,3,1,2,1,768
266,"PRIMARY PATHSHALA UTTER BHAGOT",892,602,0,1494,603,289,0,892,700,0,124,5,468,282,1,0,0,0,0,0,2,3,2,0,5,892
267,"PRIMARY PATHSHALA DAKCHIN BHAGOT",939,648,0,1587,563,342,0,905,895,0,157,13,459,249,1,0,0,3,1,1,0,1,5,6,9,905
268,"PRIMARY PATHSHALA BHADAPUR",447,322,0,769,350,228,0,578,570,0,10,2,387,175,0,0,0,0,0,0,1,3,0,0,0,578
269,"PRIMARY PATHSHALA  K. NO.-1 SIGOLI TAGA",461,349,0,810,361,236,0,597,33,0,65,115,10,397,1,0,0,1,0,0,3,1,0,1,3,597
270,"PRIMARY PATHSHALA  K. NO.-2 SIGOLI TAGA",349,264,0,613,262,176,0,438,438,0,38,14,15,362,1,0,0,0,1,0,5,0,0,1,1,438
271,"PRIMARY PATHSHALA ALAMGIRPUR URF TUKALI",292,212,0,504,211,145,0,356,34,0,4,3,204,131,1,0,0,5,1,0,2,1,3,0,1,356
272,"NEHRU SMARAK VIDYALAYA K. NO. -1 PHULERA",625,568,0,1193,385,318,0,703,703,0,14,437,15,229,0,0,0,2,0,0,2,0,0,3,1,703
273,"PRIMARY PATHSHALA SARFABAD",742,547,0,1289,514,314,0,828,228,0,97,247,122,333,0,1,1,2,3,2,4,2,0,4,10,828
274,"PRIMARY PATHSHALA POORANPUR NAVADA",818,548,0,1366,447,259,0,706,106,0,53,14,156,448,4,1,2,8,1,0,9,6,3,0,1,706
275,"PRIMARY PATHSHALA UTTER GADHI KALANJARI",748,534,0,1282,462,301,0,763,163,0,1,12,341,391,2,0,0,1,0,0,4,6,2,2,1,763
276,"PRIMARY PATHSHALA DAKSHIN GADHI KALANJARI",743,554,0,1297,469,287,0,756,542,0,8,134,69,531,2,0,0,1,0,0,5,3,1,2,0,756
